label,tweet
anger,"good very great actions ... Soon judges, prosecutors and retirees will rise 300% who are entrepreneur please bite the fingers of the hamb2 of money to find support.Jokowi: TNI-Polri performance allowances rose 70 percent, liquid July [URL]"
anger,"It's really ridiculous, miss your comment, just play Ignore, I think it's really trivial.He is not comfortable so he published so that it gives lessons for people who want to have the intention of teasing so as not to continue his intention if you don't want to be shown.Reminder is also Bua"
anger,"That island -made island, the new couple, so the apartment has not been canceled, later for the benefit of the people of DKI.So if the trash can can be a good cancel for what?the time to make a tadpole"
love,for the love that has been present I want to give the best love that is not only because of God but also love that is always with God the last love of love without the end of love that is up to heaven
sadness,"Yes, you know, also understand that the name of separation is not good ... but depends on how we react to it ... and don't have to hate ... especially with those who are not wrong what ... enough with an attitude like that.Again."
fear,"The scary section, Caraka night in the middle of the wilderness.It's already hard to imagine, original scary.told to walk, told to do a very long password, in the middle of being given a problem, in the middle of the same end there was a pocong2an, not yet passed the trench, without any lighting.Original chaotic.[URL]"
fear,"I wonder how.The path that is also passed through the truck too.I thought like this ""Did you not get my life?""and some other curses.And the road is lacking lighting and many are fighting the flow of the road."
fear,"[Username] Yes, I like to think about if you live in a kind of kind, tomorrow is still given a breath with God?Hopefully we are protected by AAAMIIINNN"
fear,But then there are those who doubt because of the maintenance of the BPJS history.Afraid when read as unhealthy mental.
love,"Believe me, establishing that relationship you must believe in your partner.No matter how bad your prejudice is, he still keeps his love for you.and I've been in your place guys .."
happy,Thank you who have come Sparing Footballl today.#UnitedIndonesia #UnitedToGETHER #UICI #UnitedIndindramayu #UnitedIndonesiachapterindramayu @ indramayu regency [url]
love,"For some reason, in this place I feel very close to the Creator.For that I always want to visit you Wukir Mahendraku.[URL]"
sadness,"[Username] Via Vallen gets sexual harassment via DM Instagram by foreign soccer players but at local clubs and, netizens are blame the Victim, again, and sad that the girls also blame."
sadness,"To Sushi Tei just want to make a boomerang and tag location showing off a list of kek menus while mbatin 'basic kismin, you can't be like this, wek!'"
fear,"Hearing a strange sound around him.Jek shuddered.""Did someone talk or not ??"""
happy,"I was chatting with Kiya Dek, pray mom, deck, so you can blablabla.Dek Kiya help pray.*nodding, smile "". Sincerely, his face. Even though he doesn't understand what is meant, but every time he says, he will smile, he must smile"" smbl hugs."
love,again like it.But afraid of wanting to follow.The gap is the contact too.And this angel is playing Askfm.So I use my daily life to ask questions using anonymously mode.ha ha
happy,"(1) #Ramadan Hai Tweeps, through here I want to tell you about Ramadan which is full of blessings.This is my first time Ramadan with a situation like this and is very memorable for me personally the day before Ramadan I was invited to be an announcer at the Foundation of the Muslim Foundation Freeport Indo"
happy,"[Username] [Username] ""Thank you yeah !!! I was very happy earlier. Even though I was vomiting earlier and had a sadness but I was very happy ..."" #Sedooooottt"
love,"Love is great, even greater than the world of marriage.Prayer is a part of love for an ideal that we have not achieved."
love,"Anyong -!Romantic namja is my dream really attention, of course, bt bt with us, can also humorous, love something, our hugs are, good luck -!"
anger,"His name is parents, is it mandatory to pay their children to school?So the lack is the name to waste money !!Everything that has been done with us is good or not that is not in vain!It's hard to be afraid to fail, don't think badly.precisely the useless one with you guys judging like this"
sadness,"Shocked to get the news of a neighboring RT in Solo, still 19 years of death from Typus and Ambeyen.He took his life really not seeing age.Innalillahi wa Innailaihi Ro'jiun, Sending Al-Fatihah."
fear,"crammed ... puberty, in the KRL is one of the temptations in fasting ... Moreover, dpn there is a beautiful woman while chewing knowing gejrot ... hehe .."
anger,"I'm really ignorant, that's how much, but there are those who make it uncomfortable or uncomfortable, just be careful ... don't until I invite me to hang out breng"
anger,This thread is offered by women who are permissive to the harassment experienced by other women on the grounds that such events occur and no one complains.khanmaen .. [url]
fear,"Please also trace the arrest of hundreds of suspected terrorists, dozens of them were shot dead when they were about to be arrested.[URL]"
anger,[Learn for your parents !!!] You know !!Your parents have slammed the bones for us to heat up to the rain
fear,"Always be afraid if private chat to the lecturer.Afraid of mistakes a few years ago.Wrong Send Selfi to the Lecturer, the intention to make the gedakan Q instead sent to the lecturer: & the Posenya Gabanget was even funny asking to be given a value of C bgt anyway."
happy,thanks aji happy birthday
sadness,"But on the third day, it turns out we lost.Two questions that we should have answered successfully seized by the opposing team.We are late pressing the bell.We lost focus.Twenty points floated to the opposing team.It was enough to punish us to fail to advance to the final round."
sadness,"Read the message on WhatsApp then think .. I sometimes like too good with people.But then I realized.Not sometimes, it's always.Understandably, Angelic."
happy,"Want to say the 24th Happy Birthday for Nursehah [Username], hopefully the blessing of age, cheap fortune, always healthy, more diligent in worship & remain a strong woman who inspires many people.wish u all the best girl #inisahurtiketcomHarike20 #Netmediatama [URL]"
love,"[Username] I remember, when we were still joking with each other.Our story is written in the most valuable memories.You and me, together in one word -love."
love,"Just look at the WA notification being replied, happy half to death, the Gembatnya for days.IG Story is seen and IG post in love, excited about dreams.Falling in love often makes someone childish again ... [URL]"
sadness,"Some have discussed about Tinder and at that time did not understand, because I was curious to download it.Eh, when I downloaded it in your heart, say what application is this?regret directly download without reading the description: ') maybe it's cool for some other people, but not for me."
fear,"Surprisingly, stressful people are still roaring at Salemba.2 weeks ago also after a boy's time too, like that, where did anyone want to feel at home."
love,"I used to like it, until I was accompanied by here (.....) but he wasn't like the one who said, so he dared to like it.Very polite, Allah.taught the language with my mom, obedient bae wkwk!Poko because he was only able to think of everything"
sadness,"[Username] Parents' encouragement too, their children must be smart in the academic field.Yes, I'm not mistaken, parents just want the best, but the wrong way to react to it"
anger,"[Username] [Username] [Username] [Username] Then your club doesn't ride like that with the Provincial Government hahaha already has a personal stadium from Persebaya management?Persija is able to rent it, why are you complicated hahaha jancoook jancook"
anger,"Figure and Candidates for Abadi on Org who failed in Laluny means that people are most like God, because their brains are leaking, leaky followers, but the brain is MOTER2 [Username] [Username] [Username]"
sadness,"[Username] 1 week before the father died a little made you angry, and my regret was that I had not apologized until the father died"
anger,"yallah ... yaallah ... w, just want to scroll ig, just open it using internet explorer.how come I have felt a lot of IG system instability lately ... I really say what I am"
sadness,"Yes, I just remembered that he had been tired of waiting for me to think of him just a friend, and now I am tired of waiting for you to hug me again."
anger,"Is it just here who thinks that women are never the owner of someone as a whole & only belongs to her husband and family from a religious perspective?It's a bit disturbing for the resolution of household conflict while the character of my husband & husband is ugly, the wife must be piye?!"
fear,What we have to fear is when we our wife and children appear to be genitals.And how is the law to put up photos on social media?.#nu #panelnnuruddin8642 #satrionkri #ngaji
happy,"cool gt, yes, I have acquaintances who know about history or not discuss philosophy philosophy, discuss Fallen Angel, anyway, Conspiracy Theory and likes to have blood art, have a friend's art like that !!!!I'm going to keep the main lol."
love,My youth.want to learn and travel.So that someday we get married later.Not only about work and household.I want to invite you to travel too.to the place I had visited.Then you say and hug.Thank you darling.
happy,"Next to the life of Ario Bayu's family aka the handsome Alpha team commander who is black and viral on the social media.Yes, a family who is quite happy with a little daddy girl."
sadness,"The girl is the most not like being stated, lied to, ignored and accompanied when there is a need.: ')"
sadness,"How many inappropriate words from male netizens but doi Stay Calmdown.It's called Public Figure Mah Kudu Setrong, Ms. Ariel"
anger,"The most disturbing statement tonight's ears came out of the mouth of the government of Ali Mochtar Ngabalin: ""The government is a representation of God on earth.""The more decadent our democratic reasoning is that the view is so allowed to control the palace.It turned out to be the same with the old man."
anger,"The highest angry peak is no longer cursing.But when someone doesn't care at all.Even when you try to look for his attention, he doesn't want to know in the slightest !!!!!"
sadness,"Qu also willing to koh, I disable Instagram because it was too much explore: ""All toddlers are taught for tiktok too [URL]"
sadness,Secret admirer mah so Instagram Difollback just immediately made an announcement to my friends.Even though you are like that.Like who follback who follows him.Ampe olshop may also be difolful :( [URL]
love,"I love all my mutual, sorry if you can't be a good mutual for you, Luv #TeenechOice #CHOICEFANDOM #Btsarmy"
anger,"Moving buildings, the better service is getting more and more.I thought my time was only to queue here.thought there was no other job.bucking bucking"
anger,[Username] [Username] Sukarno who dispersed Masyumi Lai Jaleh Dek Ang Jiang .... Masyumi vs PKI Sukarno Bela Pki Si Jok or Boss Mega Sukarno Children Disband HTI The same reason when dispersed Masyumi.
sadness,Going home already D-4 Eid dilemma.Like not being able to do anything at home before Eid.Iftar with only 3 days with family as well as meal.
anger,"If Fadli Zon wants to know what its relevance is, there are many reasons we can find, for example the Terrorism Law that is in the DPR, how come it's stupid"
happy,"Many say ""You're already a teacher who is a mother and soul of a man who doesn't want to try, even though your material is gag how much but many who are amazed"" smiling and billang allhmdulillah it turns out close to many small children can have a positive effect on us [url]"
sadness,"I prefer to be self -conscious and think again rather than blaming him.Just to know that I sat for too long and enjoyed the chat until I forgot that there was a door waiting for me to pass back after coming to visit,"
anger,wow this ... whoever the president is to let the Pancasila and NKRI dissolving group live in this republic we will fight.[Username] [Username] [Username] [Username] [URL]
sadness,The most relevant thing for this week is.I have turned on the alarm on the alarm clock and cellphone hours but I just woke up to turn it off and then sleep again and ended up getting up late.Okay Syap
happy,"I was very happy to go to One Fifteenth Cofee, Inenet was fast, there was a plug, working on Inter peace.No wonder at home in a long old coffee shop."
fear,"Since then, my room I did not give a chair (so that he didn't sit in my study chair).If you sleep, the lights must turn on, because it's so afraid that suddenly the doi appears when it is dim."
love,"if the doctor is called ""doc"" - if the nurse is called ""sus"" - well if the pharmacist?""What"", ""Tek"", or ""ker""?Yes, well, confused.I'm personally more happy to call ""dear"", it warms ma heart"
happy,"Morning Study 4/6/18 Pain?alms.sad?alms.You will never know from the door of alms, where God will restore your alms in a form that you have never expected.There are many other miracles of alms."
happy,"But even though he opens school, the contents of the IG video are knowledge for all modeling.wonder hasn't she think about all the pro models that could look into her profiles instad and stole all the knowledge?It's different if people are humble"
anger,"What is the basis for his stuck?Read only one verse?I'm just ordinary, what are you doing angry?Atheists are actually very ridiculous to me, when they worship Charles Darwin with all the theories of superstition and silly ..."
sadness,"The problem was that I forgot what year I tried to play ask fm, there wasn't a month I gave up and decided to ... no, thank you, I wouldn't return to this social media again."
happy,"Dak, let's just go to Bandung, tar there the cost of eating with accommodation, don't think about tar, just come along.If only I was allowed to have participated in the invitation to Bandung"
fear,"Prof. [Username] Please share the complete story about the photo of the mother that I shot when the Maghrib prayer in the Church of the Pniel Chicken, so there is no information on the pieces of.Thanks Prof."
anger,"[Username], [Username] How do I want to choose Golkar, because people who are said to be important, do not strengthen investment in Indonesia, save shares, he said, if you see Bakrie Group shares!The government needs to be disciplined PT2 SPT Bakrie's shares [Username]"
love,"unfortunately meuuu, it's really big, you don't feel like the feeling yesterday was born now, it's already big, really nagging again"
anger,"[Username] [Username] From the first [Username] occupying your position, the people have never heard and saw the work and real achievements that you gave while occupying the position. Try to ask why [Username]?Abdi People Need Seoran"
anger,"[Username] [Username] racist is directly proportional to Govlox ... Anti Pancasila Most of Govlok and more racist ... Want to replace the president?please want to support anti -Pancasila, the country is decorated with racism and germs ... mongooo ga"
sadness,"That's lost.What you should learn various theories about social, here you are given a variety of numbers and formulas that make it uncomfortable, and the fall instead becomes the most left in class."
happy,"Enjoying every pulse of my heart feels every breath of breath, slowly consciously each eye opens and closes again.Feel, enjoy, contemplate, start to close your eyes, breath long and smile, feel this body seems to float off with all of His blessings"
sadness,"This year also want to maxain.Yesterday I wanted to die because of the daily installments 150 thousand/day (Eid installments 10 thousand/day, I got 3 million, I joined 15 ciji).The weight is because I and my wife's business together, the name is business, there is a ups and downs, so it hasn't been established.Great"
anger,"[Username] Yes, it's different from Via Vallen, I used to shake the shake, but now he is far from the word, trying to change the image of dangdut singers in general he is also far from negative sensations like marriages, playing exciting movies, etc."
happy,Thank you friends HMJ D3 Nursing STIKES Al Irsyad Cilacap for sharing happiness with Mbah Kakung and Mbah Putri [Username] [URL]
fear,"Don't forget to take care of your health, don't stay up late, eat vegetables, if you've finished college/school, go home, don't like wandering, you are worried."
happy,"[Username] Esbuah 5 thousand, back and forth 20rb gojek, buy 4 pieces of 20 thousand fruit, so 40 thousand ... worth it is the original from the city that sells Ceban 1, it's rarely severe ... wkwkwk"
love,"RP Hai Ele.Sorry, I'm not romantic.I just want to express my feelings.If I'm interested in you, I love you, I love you.I want to be serious about my feelings.It's not a long time.Ele will you be mine [Username] [URL]"
happy,"The beautiful string of self, the contents of the tumult of life orchestra, give a melodious tone of a cheerful life performance.Hopefully the health is always the beautiful contents of the strains of the tone, let the song successful on the stage of happiness of life happy milad oom [username] barakallahu fii umriik"
love,"In the past ... I used to have a crush on an initial elementary school friend.Trs have ever prayed for a match with him when he met again when he graduated from high school.Eh, unexpected, inshaallaah, his soul mate is the same.Although different people *due to specific prayers *"
love,"[Username] Loving Jaewon can, love Jaewon can, so Bucin Jaewon can, so a good wife for Jaewon can, just request what he wants"
anger,"It's delicious, Metal Bong ... Bobok at the Prodeo Hotel in Fire Mak Mega Hahahahaha, so don't pretentious your metal, you're alive ... entangled in OTT, PDIP Fire Regent of Purbalingga [URL] through [Username]"
fear,"[Username] Hihi, how come it's really fun.Juur, I don't believe that, but honestly, if I myself feel scared.#Trans7rumahuya2507 #Rumahuya2507"
sadness,"I don't need to be anyone who doesn't need to be anyone who doesn't need to be anything I am quite happy, I am quite relieved and proud even though I just became a dust item attached to the NU flagpole that did not have time to continue until the end.(KH. Munif Zuhri) #Nahdlatululama"
anger,"Radical Ustad, Radical, added, he wanted to be proven 1T, obscene rizik, after mobilizing 212 stupid, now his supporters can bite the fingers fooled by the obscene priest running away to Arabic ..., eating the promise of heaven.[URL]"
fear,"Please clarify the chairman [username] so that the community understands, which or what are the criteria for the prohibited Eid gratification & are promoted that criteria ...?"
happy,Just listen carefully to the song Nge hits on Tik Tok.'Aisyah falls in love at Jamila'?(right?) Ets Jan forgot *two fingers two fingers = four fingers
anger,"Beuh KRL JKT -Cikarang Mah don't ask again.Shortness bro, where is the officer?Crowded Gitahumah can't walk here and there or how to report the officers?If there is a harassing hajar ja at the place of the culprit, you will be crowded first."
fear,"yes, the name of the name is afraid, yes"
sadness,boarding fitting and it turns out the delay minute -_- Terminal W/ Others)
sadness,"[Username] Hopefully it is true because the dignity of a habib must be guarded by many followers who are willing, let's just in defending his lord, especially if he wants to be a presidential candidate who must be ready mentally because it is not possible to win"
happy,I don't see it
love,"If the context likes it can still use alesan like yes I like him because he is handsome but if in the context of dear, I don't use alesan again.whatever [username] do that is what makes us fall in love with them for no reasons"
fear,"Mas [Username], want to ask, whether by falling in love again, starting again from the beginning of the introduction with a new person will make the heart that used to be sick?"
happy,"[Username] Good afternoon, Post Friends.The shipment has been received, friend.Thank you for entrusting and using our services :) ^FD [URL]"
happy,"If you know there is a long holiday - besides Eid - it feels like I want to quickly carry a cerrier using shoes and then go, meet nature and make peace with it,"
happy,"Countdown to Lebaran holiday, I must download a lot of drama.It's already Eid, it's not fasting, it's okay to watch the scene of the Karya's drama?"
happy,Now I see my friends at graduation even crying.
anger,"[Username] Each people should not pretend to be smarter for belief, faith of belief, not as easy as this is spiritual talking because it is in the bloodstream of our lives."
sadness,"dear sir [username], sir this is really not there is no holiday after the holiday sir :( the red date is just a day, just returning home prayers when it immediately migrates again sir :( [url]"
anger,"#ilcbpip is correct Prof. Suteki.if it is necessary, BPIP is established ... the time the person who doesn't understand Pancasila ""afterlife is a future prediction"" .. tsk tsk .. politics reply to the mind .."
sadness,"O God, I really want to stop spinning.Feelings are getting here every minute not really really.The next thing I know it's been an hour, even though I just read the articles on the internet"
anger,"Waking up immediately told to leave but told to take a shower first and have to arrive before Asr, just imagine just wake up at 3 -_- [url]"
anger,Haiyaa merchandise Lu Olang rich IM ISIS HTI does not sell a ... [Username] [Username] [Username] [Username] [Username] #2019Blippks.[Username] [Username] [Username] [Username] [Username] [Username] [Username] [Username] [Username] [Username] [URL]
love,"My Reaction: ""Astagfirullah is a child who is really handsome, the sound is also good, the song is also good, the tone is right in my ears."
anger,"This grandfather knows from where he gave guidance?Do you know where if he's misguided?Do you know where he is more right?Don't feel pretentious, grandfather will be in your hell due to being too arrogant.[URL]"
fear,"Really, in my place there are 3 churches, I have never seen an immunization for their children, and in the temple also the same, there are also no ... really horrified ... [URL]"
happy,"Alhamdulillah Prof., after speaking last night at [Username] it was cool, hopefully it would bring blessings.aamiin yaa rabbal 'aalamin."
anger,"I don't like arrogant people.I only have 7 hectares of land, abundant assets, balances in the 12-digit account, and even then (only one account) and have a lot of investment in Dubai just secretly."
anger,"So, who can't be held?Let us survey this one.Is it the same or different?I think it's the same"
happy,"Tesbatan Village several times to my hometown, I didn't think that there was an area of ​​rice fields as good as this.Understandably, while stopping by to the village of Tesbatan, amarasi, I just stuck"
happy,"The development of technology will never end.The longer, humans will constantly innovate for technology including internet connection.The positive, this can definitely help and facilitate human work."
happy,"[Username] [Username] [Username] Thank you for laughing, hopefully it will be a good deed in the noble month, can make fellow servants laugh happily"
happy,"For some people, this song may be alay.But this is the first song that Ai brought it using a pretty good sound and stage.I was nothing back then"
anger,"Someone feels Pancasila, but anti -politics.We live in a democratic country that uses a political system.That's why politicians, quickly understand.that the level of apathy of our society towards politics is increasingly rising.Don't continue to corrupt and break promises."
anger,"[Username] Same Traveloka email continues.call the call center only 1 time because it is not useful at all.Then finally I will be on Facebook full of curses with Garuda.Eh, the night has entered the transfers of WQWQ.Depending on the airline I think.soale sodaraku ref"
happy,Small ideals: Farmers graduated from elementary school: Doctor/Pharmacist graduated from junior high school: Nurse/Psychiatrist/Fashion Desaigner graduated from high school: Nutritionist/Interior Designer/Graphic Design Expert.Graduated from college: All goals are granted
love,"Girl's expertise if you really love.maintain, .fighting for,.withstand the pain,.Patience and.loyal."
happy,"Yesterday this #TSYGMC book was treated by Mas Agus Noor for the hashtag #Bacabuku.I am happy to see it, even though I am an apostate child for a million years, I didn't write fiction #workshopcerpenkompas2014 [URL]"
anger,"Here, treatment with me is just waiting for a doctor, I want to queue for a long grocery right ~"
love,"Happy First Messive Sayang [Username] Sorry, it can't be the best for you, you can't be happy in you completely.But I always try to change for the better for Aley Ily Bae Stay with me yes [URL]"
anger,This referee yesterday's leadership was good now!
fear,"[Username] Ohh so.Afraid that there is a problem because ... afraid of being fined due to a sense of disadvantage ... hahahaha ... one more ... for the Branch PPh still reported with a branch NPWP, right?Cab"
anger,"There are more ridiculous than the sexual harassment case that befell Via Vallen: Politicians & AMP Political Parties Use it as a ""stage show"" under the pretext of defending victims.#HiliKinthil"
sadness,It is concerned that there are Islamic groups that set aside national groups .. #2019Tapjokowi #Jokowi_2_PERIode #Jokowibersamarakyat
