label,tweet
happy,"This is a miraculous person ... I can also joke the change with him.I said what he said, then he knew it.I was surprised.But happy."
love,"Comes, this toddler welcomed with happy, wanting to hug the old, stuck, every 5 minutes the bathroom ""Imo hasn't bath yet?"".Just want to dry the towel, asked where you want to be afraid of going again.Continue to be hugged not separated.loved this fun."
anger,"ah homecoming how come it is prohibited through the toll ... basic tolloll ... if through a fair debt ... we pay why bong.Besides, if you can pass, each toll gate is given, the toll is special toll and belak ... later we will realize it ..."
love,Dear Abang Sayang [Username] Hopefully at home with his new agency.We continue to support whatever your decision.We believe in what you choose.love you ok taecyeon #2pm #hottest #indonesia
fear,Just look at Susan's doll forgiveness.This is even invited to watch the Sabrina doll horror movie.
anger,"The end is not a matter of coffee or money that comes out but how do you treat and serve consumers when there is a complaint of the goods/services sold.Remember that, yeah, hiii mba barista [username] gancit."
love,"Because for me, loving not only by giving an expression of love, but how we make each other smile, comfortable and happy.By accepting the differences in traits we have."
love,"Even though Papa wanted to cry like Mama and hug you tightly.All Papa did was just wipe a little tears in the corner of his eyes, and patted your shoulder said ""Take care of yourself, dear"" Papa did it all for you to be strong.strong for adults."
sadness,"On this 21st night, I pray, hopefully what the overdose in this country will soon return to the dose of whatever it is, who is just, just the middle.excessive is not baeek"
anger,"Buy a trash can made in Germany so that it can be equal to European countries. What is the relationship? After all, it's just a barrel, just a container, it is impossible to equalize the nation or the community through the trash cans like that."
love,"[username] sassy, ​​spis, or not ashamed, severe fussy, nosy friend, the best chef of all time, who loves me the most, who defend it to go here and there, and 1001 ++ other things that can't be expressed in words wkwk"
love,"Thank You.Has ever made colors in white paper, have arranged flowers in an empty vase, have sang melodious in the silent room and had been us in one bond."
anger,"The trash can in Germany is okay, just positive for Indonesia, it can't be made.Tongtong bus changes scania too, right?the important thing is that I have been corrupted."
fear,"So there is a THR but from the APBD.Those who have the power to be afraid, if underline with the KPK.And so they can get this year's THR.How can that be like that?Buk Minister says safe.the other is scared."
anger,if you choose a leader not incumbent later so the Gub does not know & lazy to work like this [URL]
happy,"duh so the story is ... the point is, yeah, if we are always grateful ... always feel enough, resignation but it will be fast, always there are things that we can feel lucky in the midst of the increasingly higher life challenges ... and parents' prayers are the most important.."
happy,The name of friendship must have joy.And this is where we learn and process together.Grumpytard minoruliciouces #friendship_goals
anger,"Already know the verified account, indo netijen is fierce, already the mamas has been devoured with netijen.I think the speakup here is this way we complain about it to the stronger party.If the children go to parents, teachers, etc. so we can find the masses to hate the perpetrators.What's the difference between your own judges?"
anger,"I feel you [username].Often the not because it doesn't use, but it's more because it's not appropriate.can include all day me and start getting rid of it ... the problem is that if it still looks, Ky who is angry himself.Sick"
happy,[Username] As an entrepreneurial spirit or entrepreneur must dare to take any risks for the sake of his initial failure of success
anger,"PLN EMG PHP Circular Maintaining Region A until 1 o'clock but now it's already 2.40 Electricity has not lived.If you are late, pay the bill, this fine will be a power if you die, you can get a discount or not?[Username]"
fear,"Logic, when your house is asked to accommodate people you don't know for 40 days, aren't you afraid and uncomfortable?if I'm afraid and uncomfortable even though there is a recommendation letter ..."
happy,"Leave a greeting for Masbro [Username] if shooting bring bamboo, so it is not to make it so that it doesn't work."
sadness,"Want to tell you what if it's like this?Destroyed life, think about how my heart I was sad, I cried until I shed tears like the lyrics of the song dear Pia Palen deh wkwkw"
fear,"[Username] [Username] [Username] You are right.Not in all places we may perform prayers, one of which is in buildings that are erected for disbelief (one of them is a church).I took refuge in Allaah SWT.from the temptation of the demon that"
happy,".... ""God will not burden someone but in accordance with his ability. He gets the reward (from virtue) he is trying and he gets torture (from evil) he does.""QS.Al-Baqarah: 286. The key is to find a solution to the solution."
sadness,hiksss [username] KNP area Jln Jambon (Kodya Yogyakarta) often dow up ??This MLM is dead again.why oh why in a big city how come the electricity often dies
sadness,"For people who just like to read, buy two novels must feel heavy and objection, even though tar if you've been fond of reading a book, buy 4 sometimes still I still know: (("
fear,"But even more stupid when I died, when I entered class, I wanted to say goodbye to the lady that wasn't there, Ms. Sisil, Uda was shocked by her."
love,"Only [Username] who understands how to handle me if I have gone berserk2, love me without telling me to change so other people, patient, understanding, people who are always advanced at the front if someone"
anger,"that sis is not deserved to talk roughly even though the price of fondaition is exorbitant, anyway it won't be beautiful as long as it is ""that is fondaition. Because beauty is only for the temporary too, then the wrinkles are also dead, the beauty in this world is only temporary"
anger,[Username] [Username] [Username] very bodo bonek the jak can't get along if the model they are like that.disgusted if you have to be one mindset of their SM.Permanent stupid
sadness,"What's the hassle if you just read without understanding, well there is an error, not an understanding ... selective to the argument of not papa, while reasoning remains on the track, not off the track, if you have left the path that is a violation .. #Celotehreceh"
sadness,"[Username] Father from the past until now working to move around the city, I migrated.A few months ago I returned to Makassar, my father also happened to go home.but did not have time to meet, then in the phone invited to eat together, I refused with the reason to go with TM"
anger,"Hopefully in the future there will be no barista [username] gancit ngeelin.The period of ordering espresso that should be bitter so sweet.The coffee you sell is not cheap items, so it's natural if you are looking for perfection.This is the first time there is a barista like that."
sadness,"Yes, it's just a beb2an again if my guy is beb2an but I know it's just my friend trying to understand why you have a grudge with me so"
happy,"[Username] In the past there was really a UI Engineering student shooting his girlfriend when he was dawn in the steamer of Depok Engineering, covered by the crew saying love (and not dating them).Now it's married and have children.never told the UI Shitpostost/Divarpostost page as well."
anger,"What exactly is that ondel2 is?Dateng only looking for donations ... I am comforting people too ... right too, often, I often see a blank look.Actually, what are the benefits of ondel2 for?just just bang ... the mission of riding through already, that's all?"
love,1Thn I am far from them but I know that their prayers are always with my love that makes me survive in a distant and foreign land ..
love,"Hurry up, dear, so we can play again with Mimi Mimo so that we can walk again I Love You Boo:* @_Kngdaniel96"
happy,"Thank you, God, I was given a rare opportunity like this"
happy,"Wow, when do we take this photo, eonnie?Is it right at SMA 1 Baradatu's birthday?in the sight ... #Dontforget #ya #eonnie #sangat"
happy,This is the happiest thing when I can take a photo with Elf #returnofthelittlePrince #happyheechulday
happy,2010?The first time I was treated.appeared after #friendster who rampant rampant at that time.The time when juvenile delinquency gradually merged to achieve their goals.So beautiful at that time.#thankyyoutwitter #harijaditwittersaya [URL]
love,"Happy I am with you, in every second I always remember you, for some reason I am imagined there is always a beautiful face, my dear, I miss you dear love you hadad dear the night"
sadness,"Every time you want to complain, you want to protest the same life (and every problem in it) so ashamed of yourself because it turns out that too much blessings who are too grateful to be thankful"
sadness,"In the past, if bullied, he likes to be angry and keep being pursued by the bully.When I was not caught and the body was tired immediately appeared a grain of water pouring out of the eye."
happy,"Cinema tickets Cinta Ayat, still stored and used as a bookmark, watching the four of the RSUT era with family, the definition of gratitude is to look and invited to walk, out of the hostel for a while"
happy,"Mother and child.Yes he is a great woman, the supervisor of us all in the Department of Emergency Department.Thank you, Mother, her mother PSC 119 of the real Tegal District Health Office.Proud!Despite having 1 school -age child and the other TOODLER, he still stayed 24 hours for reconciliation.[URL]"
love,Hopefully you also feel it to live and look at the sky tonight so that you see a full moon there are stars there who always accompany and watch our love when we fall asleep.
sadness,Damn haha ​​than you are upset we hehe you are already from where stress Div
sadness,"Fortunately there are both parents and people around who love me, awaken me.That a broken heart should not make you not finish the thesis.Life must continue.Don't expect too much with one person's grip, while you have actually got a lot of hugs."
happy,"15 years ago you were present in the middle we became the successor to the generation of Zulkifli the first grandchild for his grandfather happy birthday Papa Bayujuli1007 15 years old, so male [URL]"
happy,"So yes, regulating Yu Yu's readiness to have children not only from mental, but also financial readiness.Must draw men.I believe, plants that are well cared for from the beginning are different from the same quality, just live."
anger,"DPRRI holders of the people's mandate but always reverse the palm of the hand, the council that makes rules and councils that violate the rules, a handful"
sadness,"If for you the word ""dear"" has no meaning and may be accepted by anyone, it seems not with humans you interact."
love,"from Allah.Masha Allah!Allah loves us so much.Because of that, even though as high as the mountain, the sin that we collect, God will still forgive every our sins.The love of the Almighty that was once in nature is the love of God.\"
sadness,"If in times of like this it feels like I really want to live in the village, O Allah :( in my area there is no custom of the sunda huhu monangis"
happy,"[Username] Already using feelings once we are.cmn bnrn caesarean sm connor who is ok, Didi sm Darren its not bad.fortunately like the sm who sang"
happy,"Originally Pontianak lives in Semarang sis .. I'm a big fan of small towns and old shop, very happy because there are many in Bandung diary heehehe .."
happy,young fasting this time brings changes to all of us #jatengsaruratorupsi #jatengsaruraturupsi #jatengsaruraturu corruption
sadness,"brew coffee with tears that are hot enough, producing a puff of the past from the sweetness of memories, the bitter is left behind"
anger,Mardani & [Username] Mingkem can't answer!That's why the intelligent community #jangan chili partaioposan is misleading !!!!!
happy,"wow this is really funny design [username], there are bati and hello kitty also #goldreinvented #antamlogammulia"
anger,"Yes, I also don't want to live in Tngh2 Kelilingin sodara2 mama who is evil siring and crazy evil loudly bokengli najisin is not willing ... I have to move to Canada"
fear,"Dek, I'm just afraid, my feelings will exceed the limit as a senior.Stop?Even though the reason you informed me was because you were bored."
anger,No longer understand the same Ciwi-ciwi who is Via Vallen.He is a victim.Is that difficult to support each other with Gurlzz?
sadness,"How can the ""champion"" bird be easily fooled, and return from their long journey with only a mouth full of plastic?"
fear,"O Allah, very horrified that the BRUSAN SAWA is the size of the Pralon Palon GT, so I cover the door of the body, the body is elastic, it can be entered between [URL]"
anger,[Username] Guwah agrees with you bro ... this is the most feared by those who are competing to be able to nominate ... so they are always looking for ways to download the hrs.apadaya .... God's will ... must be even more shining [url]
happy,"Food test rendang duck again, by Mr. Uyul Juragan culinary owner of a coffee shop [Username] ... Alhamdulillah passed the test, he said cociiks, and was recommended directly played.she [url]"
sadness,And tomorrow must be in the morning of South Tangerang ... and (again) it can't use Emoney etc.and (again) must use queuing to buy paper tickets and (again) tomorrow Monday
sadness,"Needs before Lebaran day are increasingly urgent whatever everything must be in the price while the price of basic food and use all of them replace the bandrol/price, hopefully given patience do not be rushed by the air of irresponsible devils"
sadness,"Honestly, I am experiencing boredom in the current zone.Starting to be bored with everyday life, people who are just that, just the chat, and all that is the same."
sadness,"[Username] :( Coming home from school ceplokin then Mam Baso 10,000 is enough, it used to be that simple ... Boro2 MAW there is a Pansos2an .. IG era so this great event you make your teenage brain unhealthy"
sadness,"When the taste is high, then someone will want to know anything related to what he is interested in.Well, here the role of the real respect.Our habits (because maybe I also like that) like to laugh at the things we think are funny but that's the thing that other people want interest."
love,"From a distance, I always see you.Happy, dear.I love you.always."
anger,"From the morning I felt stomach pain I wanted to menstruate, I already bought Kiranti when I was checked, instead there was no, please, just menstruate now, so I could join the Eid prayer"
happy,"Wozniacki Out!Daria Kasatkina, LHOO ... the most cool, super fast & trapped.Barattt.Goodluck!"
love,"Alhamdulillah, dear [username] I am not in vain, for a few months, I am ambiekin if I am lazy, I keep chasing so that I will be fast, I will not betray the results, rite?one step closeri love you cayanggg"
anger,"Germany is mostly good players or what?Sane class, Young Player of the Year, not called the national team ckckckck puyeng time nii om joachim .. [url]"
anger,"Almost every day Mbak Kos likes Ributin ""You are two bodigard vela who likes to play the boarding yard"" -_- Mon sorry, Ma'am, my friend really knows he is playing the boarding yard with the sound of a big motorbike almost every day every day every day every day"
fear,Every time with you is the most valuable thing for me and there is always a sense of worry for me no longer able to be like this in the future with you
anger,"Indonesian netizens are mostly willing to exist. Considering cyberspace as a stage, sometimes they play the role of wise people ... sometimes spicy judgmental"
love,"As a supporter [username] I don't like Barca, but as a football lover I like this movie, cool #heartofalio [URL]"
happy,Still not familiar with their twitt using English but thank you [username] for make it easier to watching them [URL]
anger,"[Username] [Username] Wow, this is very sir, as an example of my village road from the Parmonangan intersection of three balata to Bosar / Bandar Jawa is extraordinarily damaged"
happy,Agree .... moreover it can be thrown into the trash in accordance with the type .... like recycled trash and rubbish that cannot be recycled.#LifeATIril [URL]
anger,"[Username] I am not the queue, but I am waiting for the signature of this academic wadek masyaallah bget yak.yet if the elements that deal with it already.yes especially this is fasting and late home fast hmmm"
happy,"Finally ... Because the goal has been achieved, dare to open twitt again, not afraid of spoilers again ohhooo"
love,"94. Dear Member Livable Mince love with you, Mince will fight for all of us ... but if there is no support from you guys, what can you ... thanks for accompanying Mince on Livable Ka, Minceee dear kk livable"
anger,"yes the problem he wants to enter the religious blasphemy party is the right of his choice ... who is unfortunately, not need to carry the name of Allah and carry the name must be"
sadness,"[Username] Everything is definitely different ""[URL] aq like this, I am a target.aj trial '"
happy,"The streets are looking for a new atmosphere and new knowledge, enjoying nature."
anger,[Username] No need to have a league ... How can Indonesian football be able to advance if you want to be rich like that ... want a war in Gaza Sanah ... you die of heaven ...
anger,"[Username] Please apply the application.I ordered earlier, he said the server error.Eh, 4 taxis appeared.Khan is sorry for the driver, I have to cancel."
love,"I love you because of your side, my lick disappears.Beside you, I'm awake.And with you I'm happy!"
anger,"I don't like thinking about people who say disaster when happening to other people is considered a punishment but the KTK befalls the group is called a trial.I want to miss, MATANE !!"
happy,"Alhamdulillah, Tmksh Tiara U to Beautiful Dart Ava Oy"
happy,"A good effort will not betray the results.If you've tried the best, but the results are a little disappointing ... it feels, the heart is more relieved and easier for sincerity.Yes, at least, have tried to be the best."
anger,"[Username] [Username] [Username] [Username] Come Viraling Adu Koran Jokowi who is said to be a Criminal Ulama vs. Prabowo, a candidate from Rizieq et al, a candidate supported by the party of God (he said).Make Prabowo don't pretend deaf.Listen to the challenge JK."
sadness,"Since earlier, the nose kept on when tarawih, the throat hurts."
happy,"The most happy if you seek treatment in Bandung.The same consulent can share, jokes.if in Bali see the consulent can only bow with a wry smile"
anger,"[Username] [Username] [Username] [Username] [Username] [Username] [Username] [Username] Zon Don't just look at the clothes, occasionally hold the birds, wild or tame ????"
sadness,[Username] The President of the road in our village also please pay attention ... Hamlet of Rumah Mbacang Kec Kutalimbaru Regency Deliserdang [URL]
love,The most beautiful thing for these days is always you because you are cool (a perfectly beautiful gift in my life) #InisahurtiketcomHarike20 [Username] [Username]
anger,"Who was talking about the sexual harassment yesterday?It turned out that last night the dangdut star of the idol of the homeland was hit too, the same as the famous foreign soccer player who played in Indonesia, well if this was sure all would buy his sister"
fear,"This is because close to the introduction of the campus, right, my group is crowded, then I become afraid of hearing the group notification or geter entering the message.I don't know why huhu"
sadness,"If happy is simple, why are you busy beautifying the body?You know your property, is a mortal thing.Location: Susukan Ndalem River, Mejagong - Randudongkal - Pemalang.#PESONARAMADAN2018 #PESONARAMADAN4JUNI2018 [Username] [Username] [Username] [URL]"
anger,"Where is the stereotyping from my statement?Try to show, who knows I am the wrong talking.It's good if many criticize.The more sounds the sound is heard for the truth, the better.If it is true but loud loudly the wrong one, that must be overcome.[URL]"
sadness,"Other people if you use a poncho for a raincoat, well he uses a mattress.Yes, because I didn't have anything.Mamak said, we were in the beginning there was no experience of honeymoon like now.Just sleep using Poncho.Gimane wants a honeymoon."
happy,"[Username] Morning Also Mas, duhh, so I don't get Met Met Sayings from Netijen Twitter.wkwk btw from a distance how come?Alias ​​where do you live from your city?wkwk"
love,"how I adore u everyday dear.How u completes i.Every time we have an argument, it's not la argument about who is better but about who is loved who is.thank you, u love for i touched"
happy,"We are different generations.Asik, we are old, feel young, and those who are young learn to discuss serious things in the future."
anger,"The more modern your lifestyle, the more you produce plastic waste.Believe it or not.[Username] just try it a day if you eat, how many straws, plastic cups, plastic food you throw ??#Haril environment of world life"
anger,[Username] JORR is totally jammed!From the Pasar Minggu toll gate to Jati Asih it's almost 3 hours!Many hawkers in the middle of the road.trucks on the far right lane.Pay toll for what?![URL]
anger,"Initially it was ignored, but it was very concerned that after today the salary money came out, but the time was checked, instead it was only 2.5 percent of the salary that had to come out #bni46"
sadness,"TBH, I actually have no intention of making 'short thread about child marriage' but since this has become a 'common thing' for certain people, this will never be ended to be discussed.That's all."
fear,"Anyone tomorrow please remember Aa Tommy, Tuesday, June 5, 2018 at 15:00, please text/tel/wa, afraid of the AA miss the info from Travelo *a deg deg, I hope you can watch the World Cup directly *will not be able to sleep well tonight, waiting for the announcement tomorrow*"
happy,"Uda THR right?Try it once, if you want an ordinary stall (not restaurant that is usually tip), meet the old servant and look sorry ... you slip 100 thousand.you see the reaction will be extraordinary and your feelings are very happy ... 100 thousand will not be bikij we are poor, but it means many for them"
sadness,"a little tired too, the debate with people who saw everything in the black and white context.Why can you change your view, eg from JD Pro.Is it just a matter of instant interests.can be sj, but all the decisions must have been overweight of TTT's experience.yes must be understood in the context of that experience #TGB"
happy,"Plan #Bedahrumahibibuiriyani, Trimksh Bpk/Mrs. For their help and support, this small step is going according to the plan #Timpedulitimka.[URL]"
sadness,It's been 26 days to cry every day ... the eyes added narrow ... a month mao a month the death of Jonghyun ... this is really empty ... I miss u so much..tt tt tt [url]
love,"Smiles are the cheapest media in building a relationship.#kintamani #photography #savana #vsco #balicili #balitrip #baligasm #bali #travelling @ kintamani, bali, indonesia [url]"
happy,Persibku wins again .. my Persib wins again .. oooo ..oooo ..oooo .. oooooooooo .. [username] #persibday #pucuk #juaran #awaydays #bantul #bobotohsahalamunya #bangganggawalmu you
fear,"My brother is afraid to arrive at phone with the hospital or what time yak .. scr doctag I cantumin name & phone number he is so why my sm, he will be on the phone"
happy,"Alhamdulillah 'ala Kulli Haal, Jazakumullah NTK Pak Arief and Mr. Basyit for guidance, direction, graffiti, revisions, scolding etc. for 1 semester.Always healthy, sir.keep inspiring.#LATEPOST"
happy,"waaah ... diligent, ok, in the morning to the market ... [Username] What do you want to cook?heheheheee ... Tuesday morning is beautiful.keep the spirit ayu .. #happy #happytsday"
love,I looked at your face when we first met felt trembling my soul when you smiled at me I love u.#armysecaday [Username]
sadness,"yes the discrinsut is mba boo.The net managed to find who was only with a picture of the arms.yeah, mba, it's like that, it's not a joke"
fear,"[Username] It claims to be replaced by Pet Soc Gitulo Mas .... but what makes it suspicious, social media updates are not clear and not often, I'm afraid this is only a hoax"
fear,"This is just a perception in educating.And hopefully I am not included in the parents who educate by hitting children in front of many people.Never, hopefully."
anger,"I don't see something wrong with what Via Valen is doing.If he is offended and spilled, he likes him.If he is very celo and bodo, he likes him too.U, also if you can chat the ojol driver is not polite, you also feel entitled to go berserk here."
sadness,"In solitude still force me to walk, without stopping and will not return, because tomorrow is not today, and the past will change to the future ...#Dududududu [URL]"
happy,"That's me, the number three who is generous, and I beg you hope you quickly know the #Menjarajanji Kanjanji Dek?"
love,"If now you wake up me dawn, I'm just ordinary if next month you wake me up every Monday and Thursday, next year I marry you"
anger,"Good!It's called self -aware.How could the obscene case suspect be the leader of the people?!Btw, what is the case [username]?Then the story of you nyang 'ntu gimane?[URL]"
love,I can still love you properly without you having to know anything about me.Why do I have to bother myself like this?even though the interfere is not in the required skills
