label,tweet
fear,"[Username] If I was more horrified that I was a wallet, the other thing was a moment of peling for a moment ... well, if the wallet was gone, it was prolonged."
love,"But well, I like Namjoon, not because it's getting more and more cute but because of the personality of his talent either. If the one who hasn't fallen in love with Namjoon, try watching Solo Vlive he uses Pajama Ryan you will definitely fall in love with this one father"
love,"[Username] ""Alright we go to the apartment now, dear"" he said with a smile. Amber walked while holding her lover's hand into the lobby. ""You wait here, dear, I'll take the car first,"" he said, releasing the grip of his lover's hand."
happy,Pret spends time with laughter yes it's better than spending time by thinking about you ~ what
fear,just felt the name of fear of being afraid of going out evening when I wanted to pick up Ira until I talked to himself better to meet ghosts and on the road already wanted to cry. why can be as stretch as that because you know the area that is passed again is vulnerable.
happy,"Alhamdulillah, it has become a fan of the news source between [Username] follow -up [Username] [Username] [Username] hopefully it can be #TemanantaraterForit"
anger,"There is no point in Pit Against Another Women, especially those who have received unpleasant treatment. Maybe in the past, this woman was not heart and empathy was also harassed, but instead of she was an opponent, even considered fun. Shame on them!"
sadness,When in the family group already talking about going home. I want to go home. But what is the power of the husband is only 4 days off from the day of Eid. That's also if the phone on the phone is told to enter. 2 years ago even finished praying eid lgsg work
sadness,[Username] normal. Ignore. Block a form of omission of cases of sexual harassment. Feeling the best step just silent as if silent the perpetrators would not do rich GT to other people. Such Logic.
anger,"Honestly, it's enough to break down my madness must be aware."
happy,"After a photocopy of the volume, which poured more than half a million. The owner kindly offers a ride to be delivered home. waaaah alhamdulillah!"
love,Dear Abang Sayang [Username] Hopefully at home with his new agency. We continue to support whatever your decision. We believe in what you choose. love you ok taecyeon #2pm #hottest #indonesia
fear,"For the sake of anything, I just experienced this incident, when I returned the exam. In the afternoon, again traffic jam, suddenly there is a crazy person screaming beside me clearly very much like the story below. my heart spot, I'm afraid"
love,"Love-loves the complicated things that impose irrational things to be rational. So when someone falls in love with you, don't be surprised and ask ""how come?"""
anger,"[Username] Well, I just IGNORE MBA Via Vallen because the strange thing is. Makes other women not dare to speak up with what they feel. To menstruate every month but do not have empathy once."
sadness,"Memories of high school, every time I come home from school before asking for money from my friends, each thousand say it for gasoline, but instead strayed to the stall nongki buy udud hahahahah :("
sadness,"I used to really want you to become a pulse on my wrist, when walking, passing with a quiet accompaniment, now you are just a heart, which I don't even want to hear."
love,"You, coffee, and your work spirit, let's move!"
sadness,"Okay ... try this correction, most of Indonesia's people are lazy to be smart, but it is happy to be stupid. #HoPaPaP Garlancing #SaveteleversIndonesia #KPI CC [Username]"
love,[Username] Ridiella is so beautiful! Gemeees thanks dear
anger,"duh this office friend has asked for an impromptu shift, the phone is already at 9 and then calls it. So it's like a bik buk not clear."
sadness,"[Username] that I know already marriage, my ex's electric child is my friend, and has a child ... while I still wait for graduation ???? This is already in the time of marriage or how come the yak"
anger,"Hadeh is another girl who has evil thoughts, his fingers are evil. enjoyed? Heh Ma'am, is Dangdut singer Auto Lonte? Lonte can also be subject to sexual harassment mbaaak."
love,"Anyong -! Romantic namja is my dream really attention, of course, bt bt with us, can also humorous, love something, our hugs are, good luck -!"
happy,"At that time, we were always optimistic that we would be able to compete with any team, seeing the preparations and the length of the trip that we had passed. Especially looking at the results of the first and second days of the match that we just lived."
anger,"[Username] Mak attacked bullied for eradicating mosquitoes that were never completed and always failed to save the ruler but always appeared as if what was gicuuuuu, even though we all already knew that ..... aaahhhh never mind ...... .."
anger,"[Username] I think you deserve to be ridiculed by many people because if you want to be appreciated then respect other racers, especially those who are far more senior than you"
fear,[Askmf] Earlier at 10 I dared to make Line him first. but until now I have been afraid to open the line (the application I stop so the notif) I'm afraid of gadabaless :(
anger,"Brazil, a strong candidate for the 2014 champion but beaten up by Germany 1-7. In addition to the absent Neymar so that the attack power drops, Thiago Silva is also absent. The rest is David Luiz, where is he? not brought !! Only 4 players who play in 2014 are still brought to Russia. The key to Neymar who thirsty for title."
anger,"[Username] .... The name is migrating .... good people move towards a better place ..... if Rizieq, people who do very badly run away (not hijrah) to other people's countries."
anger,"Here, treatment with me is just waiting for a doctor, I want to queue for a long grocery right ~"
fear,"wow, it's horrified too, the owner of the [Username] the car is silent, the battery can fall and the car is burning immediately ... Wow Terios in -laws must be checked too if this ... afraid of being burned when parked silently ..."
happy,"Mother and child. Yes he is a great woman, the supervisor of us all in the Department of Emergency Department. Thank you, Mother, her mother PSC 119 of the real Tegal District Health Office. Proud! Despite having 1 school -aged child and the other TOODLER, he still stayed 24 hours for reconciliation. [URL]"
happy,"waaah ... diligent, ok, in the morning to the market ... [Username] What do you want to cook? heheheheee ... Tuesday morning is beautiful. keep the spirit ayu .. #happy #happytsday"
sadness,"Having some Gildan shirts, tends to be faster and the chain stitches are dislodged, because the mass production is a little less like the QC. It's a shame if the good design is not accompanied by the quality of the shirt too."
happy,"[Username] Good afternoon, Post Friends. The shipment has been received, friend. Thank you for entrusting and using our services :) ^FD [URL]"
happy,[Username] Wuish [Username] I am waiting for the film ... Make a superhero film then send it to neighboring countries again. Let Indonesian films become a trend.
happy,"[Username] [Username] Wait a minute, man. I wasn't first. Hahahahaha this is a local earthquake, so the potential of the tsunam is also a local tsunami. No need to worry."
anger,"I like it, but just goiter and annoyed and mangkel. And he was shocked again he wanted to meniqaaa. I hope your insyaf will not be abal, bro, ha ha ha, hopefully it's pious, he just remembers or not, about Habluminallah"
happy,"With casual t -shirts, oblong pants, flip -flops, noisy hanging, ponytail, crumpled faces, laptop capital and cellphones, walk alone. Already complete SYASIIII"
happy,"really good woy song !!! Especially when watching the liver plus the fanchant. Crazy goosebumps. Anyway, this album spoiled the ears, it would be loved if you got the album"
fear,"Duh, a few days, how come I feel happy, like something will happen. This is if the reality is even the opposite is the opposite."
fear,"It's scary too, the staff are dm in fansite because of copyright infringement, which is actually true ... but immediately turn off fansite culture"
happy,"Bismillah Greetings Plur Slankers/i Indonesia We will meet at a very awaited moment - later by all of us. . . ""Slankers Indonesia National Jamboree with Slank 2018"""
sadness,"When I see the president himself, I feel like wow hurry up, I want the presidential election again. Even though I think he just chose. When I saw the US President, I felt like the world is running at a snail pace. Only 1.5 years old. Like WTF."
happy,"Together with participants from Agats, the beauty of Indonesian culture"
happy,The air supports very much for eating after that HOAM sleeps: o
happy,"Apart from the less exciting experience at the stadium, we must be grateful to the maximum of the residents of Bantul & AMP"
happy,"eh [username] the same [username] are you born? Congrats yak, here I give a small gift (?) Hopefully like it, often often play the same as handsome samcho, let me be a child hitz lol [url]"
anger,"[Username] [Username] [Username] Br out of the cave huh? You don't know your president is threatened with killing, chaotic? Ma. VIRAL VIDEO. I don't know if you don't know. bad"
love,"I love you, hahahahahahahahahahahahahahahahahahahahahaha's Mimimingg who had just completed the 6000+ row regional proposal"
anger,"You don't need a lot of wish, living in the real world, not like in the film ""Radit and Jani"". Just use a logical mindset now."
anger,"Heat Debate, Rocky Gerung vs Ruhut Sitompul, Rosi, ILC - Indonesia Lawy ... [URL] through [Username] What says Jokowi is Kacung Om [Username] Diem !!!!"
sadness,"[Username] No need to bang Karni, what needs to be opened now is cases of human rights violations such as kidnapping and murder of students in the New Order era."
happy,"I can't wait to wait for the #InternationalGamelanFestival2018 event. Solo is preparing to receive the arrival of LBH from 50 gamelan groups from home & abroad, in the 2018 IGF performance held by 9-16 August 2018"
anger,"Indonesian netizens are mostly willing to exist. Considering cyberspace as a stage, sometimes they play the role of wise people ... sometimes spicy judgmental"
love,"What if, when you feel that what you get now is really for you, you find him who you have loved in silence, apparently also loves you, in silence."
fear,"see my brother, so I don't have a friend later when you go to college: ""even though the intention is to want a lot of friends but now I am really scared :("
love,"Today is a very quiet day for me, morning before noon and evening before night. Vice versa, there is no stop I think of you, and for some reason? Why do we have to be brothers? What is your reason God!? But I realize, realizing that love is blind"
sadness,"I should be grateful to be given a fortune to be able to go to school until high and in a place that can be said the facilities are always there and complete. As for them? Every time you go to school, you have to take a compreng boat that is quite far from their homes, the great thing is they don't complain"
happy,"entertainment on the cellphone if you don't see #recehkantwitter, ask for Google Assistant to send this joke. My life is indeed a change of money. [URL]"
happy,"It turned out that I could and was delicious to eat with a menu made by my coach. Alhamdulillah, I don't feel like I was on a diet."
anger,"I Swear You, if you spend ""KO/KOH/IKO"" then I will reply as fast as lightning but not dibales anymore. can you? Yes, if you like it, the mind is everywhere, can, is it important? keep disappearing. right Iko sugus became bake"
anger,[Username] [Username] Waketum Gerindrong Dongo Instagram deleted unilaterally because you have broken the law (photo in front of the Kaabah violates the law) [URL]
sadness,"Actually this body is not healthy brought a difficult grave, cold sweat from morning but is brought healthy for d'wagel especially if there is Acha. because the promise has been long. Udh to the 5x toilet is detained if it doesn't hold it more, hmmm."
sadness,The wave of your hand I feel sad in my chest. My love increases you ... tears are not felt by me. Look forward to me in Bayur Bay ~
sadness,"Why the heck if there is an option never follow the heart, always if you don't want to do it, just because it's uncomfortable with the offer of people."
happy,"Thank God, right today I am 23 years old (1 hour). I just hope that more and more people are sincere love and care about me regardless of one eye, launch all my efforts and my mind."
fear,"Those who cry on the motorbike are so afraid of TBTB carrying a motorbike so it's not focused and even fall or a collision huh? I've been crying on the motorbike but it's not hysterical and even thinking it's scary later, I will hit Grgr Grgr."
fear,"Why not treatment? Simple, afraid one day Snap then OD. Now I just see the tajem objects still like to be afraid, afraid of suddenly doing something weird."
fear,"If you look back, it turns out that it has been the past 4 years to really fight until the end point. And now to start again it is still lazy. Or really can not open a long -standing door or just scared. Well, just live this life."
anger,"[Username] Min, if there is no Treatment of Transjakarta, it can be like a mini metro, I take this basway every day 60% of the car has a problem"
anger,And not what says the coalition is unconditional and then the coars will not share the minister's rations. ~ The reality of even political parties that were originally non -coalis were bumped by the Minister's jbtn.
fear,"I hope all the children in Thailand can be safe, if this is made, the original documentary makes you goosebumps."
happy,"See You Again, When I See You, Jogja. These are some partners who succeeded in yesterday's vacation. Who knows, someone needs to help a vacation in Jogja. Hotel: July 5-6"
happy,"Alhamdulillah, back to the city of heroes in order to accompany the friends of the training participants, all the best inspiration as a provision for the next phase of education ...."
happy,"Alhamdulillah, now dates can not only be harvested in the land of Saudi Arabia but can also be harvested in Pekanbaru (Riau)"
happy,Open on chrome lgsg appears logo wkwk #exo #exoplanet #theelyxion_dot #exo_comingsoon #weareoneexo [username] [URL]
anger,"[Username] [Username] Rejimpanik? - Our scholars you criminalize, our siblings are backed, your best friend's house is throwing bombs, your mother's car is burn ... what do you want? We will not be afraid, let alone withdraw .. #2019GantiPresiden"
happy,"[Username] Same Ear Biscuits If you want random2, 99 invisible for architecture and design podcast. Oh don't forget to listen to Mrs. Yacult's mother in Spotify. that's funny.banget.wajib.den."
sadness,"In essence, when you are sure of all the selection that you can go through, IGTT still has natural selection that is not unexpected and we don't know it's difficult or easy."
anger,"From the case of Mang Kosim with Mba VV, there are still a lot of fellow women who do not consider sexual harassment as a threat actually can be able to victim blaming. I was increasingly understanding that the woman was far more visible & far more judgemental to fellow women."
fear,"{you} guys I want to faint my hair, but before I haven't been a hair, what do you want to ask for advice? but don't be excited"
love,From your eyes your eyes start to fall in love ~
happy,"#Pwbanget is different. . Viral Curhatan Personal Assistant of Indonesian Conglomerates posted on its Twitter Acoount, the original new mind is open about rich people who are not arrogant [URL]"
happy,Persibku wins again .. my Persib wins again .. oooo ..oooo ..oooo .. oooooooooo .. [username] #persibday #pucuk #juaran #awaydays #bantul #bobotohsahalamunya #bangganggawalmu you
happy,"[Username] [Username] Agree, teach peace and convey Isalam's understanding as a perfect religion in regulating life in the world to the hereafter. Both in individuals, society and state. Allahu a'lam"
anger,"Have a small child again talking like this, a little bit nagging, a little commented. If you're not satisfied, ask the junior high school, you answer ""mom don't know the deck, mom read the book first, yes"""
fear,"When a guy starts to call you often, or even come home to see you, Papa will put on the most cool face in the world. Papa occasionally eavesdropping or peeking when you were chatting together in the guest room."
happy,"what is also good, please tlvn2an with gery nyolot2an mele wkwk surprised h"
anger,samanye udeh thief all not the jancok or not the dog is not the demon monkey hahahahaha one heart with the thief !!!!
anger,"[Username] [Username] Actually, the one who violates the Bawaslu is his political opponent? Ah, it's just getting to jump, his image is in the community"
anger,"So women don't like to destroy people's relationships. Don't be proud to ruin people's happiness. go ahead, but not happy blessings later hehe."
happy,Infrastructure development makes people feel the presence of the state in life. None other than because of the real work of Pak [Username] for 3.5 years ruled. going forward .. #2019Tetapjokowi #2019Tetapjokowi #2019TETAPJOKOWI #2019TETAPJOKOWI #2019TETAPJOKOWI #2019TETAPJOKOWI [URL]
anger,"BPIP is: The Presidential Instruction Breaking Agency does not need to have BPIP as a supervisor ... Are the people at BPIP Super Pancasilais? We know everything that is said from them, from the chairman and its members, have Pancasila? better money to make teachers effective in school"
happy,happy birthday to us [username] and happy 6th anniv wkwkwk soon we break up huhu I have to find a new boyfriend: 3 [url]
anger,"Wow, seeing Mino's problem here, so initially Mistranslate? And what makes the translate from Fandom Ono? wkwk not surprised anyway, GOT7 is also hit by Mistranslate as well as a fandom. surprised, interfere with bae fandom org problems"
love,"And for you qyaraku. Always keep your mother happy. Always keep a smile on his face. The smile that I always miss. Because you know, now you are a happy source for him. only you are the world now. Everything Lasti he did for you. I believe in you little friend"
anger,"[Username] [Username] Hadeuh just noisy about the Islamic archipelago (= Indonesia) !! According to them, they are known to be friendly by the outside world, you know, the term zmn now is not to understand cui ... even in fact it likes to be unfair to the people who are in the country. This, realize it or not"
sadness,"Wow, sorry for the cat, it must be sick: D ha there are ants in the cat."
sadness,"'The first day without you I really felt lonely. . The first week began to miss. .. the first month begins to emerge a feeling of having (again): D miss you,"
happy,"One more thing, the choice of 'marriage' is no registered. Haha so, the point is I want to free my mind, my life choices without intervention from any party."
anger,"The fortune is when I want to enter the parking lot to be grabbed by another car even though the hours are full of parking. Understandably so if there is an empty one can get it first. Eehh at the front of the entrance, there is a car that is parking and going out & amp"
happy,"I saw at the location of the film, I think in Irish, Say. Better Scenery in Ireland Dr.PD in London. London Mah Henson Bett"
sadness,"When this cute thumb already typing the heart that is more upset this is up to think of the lucky lucky giving out of the disosmed gougers, there are also all social media creatures knowing the disgrace that is only for your own consumption, instead we are laughing so ""again"
anger,"Later, I asked, ""Mi, how about the X, why is it rarely together now?"", ""Mi, the X is like that, huh?"", ""Mi Si X is like this?"", ""Mi, the X is close again with the y ya "". Well, X is my best friend, but that does not mean all the X's business I know."
happy,"Most excited if you chat with creative people, just be stunned by their ideas that you might never have thought of: ""Oh yeah, why did I just think?"""
sadness,"So lazy, the night of the night people sleep I work once just want to take the Huft holiday (at the plywood art)"
fear,Just once the opinion of the opinion in the KPOP2 account that there is BTS continues to be immediately attacked by netizens who suddenly scary. wageleteh wkwkw netizens are really scary.
sadness,Nungi bus hahaha no -entire :( toll kebon orange - tomang)
anger,[Username] Always cynical and reprimand a group of fathers in my doctoral class when it is a sexual jokes that leads to harassment or abuse. Really? There is no correlation with this high school with this behavior.
fear,"Already afraid to turn too tilted because he once fell silly and once almost fell into the abyss because of the tires of the bumps, now the speeding speed suddenly can't control the gas with the brakes that make almost dead or collision. what a sign try this"
happy,"There are so many who ask when I know in the cellphone there is a Twitter apps 'Are you still playing Twitter?' ""What are you playing Twitter today?"" 'What are you playing Twitter, try', hehe, it's just bs, it's just a smile when I go back to playing twitter :)"
anger,[Username] Still officials do corruption ... giving a bad example to the public ...
fear,"Just go to the obstetrician, if you are afraid of why ""before it's too late because everyone is different"" the cause, there are those because of hormones, there are others."
love,"[Username] Romantic guy is just a dream guy in my opinion :), and that means he does not immediately love me, with all his attention :)"
happy,"Now I understand, when I was in college, I was forced to work late for the sake of the assignment solely to prepare for you to stay up late for the quuda for the sake of work on time. ok, lesson learning honey"
sadness,"Sundays like to skip church just because nobar power rmarahs at a friend's house until his house is full, sometimes can only hear can not see the film, sad ... #oldmoney or"
sadness,"Sedi I read the comments on the evil. Between wanting to swear to feel like I feel it but it's because it's not good. Want to know my feelings after that incident? Lgsg feels not valuable, not good, shame, inferior, and many more. Especially when the people are traumatized."
fear,want to watch but deg2an is afraid not as well as the imagination when reading this
fear,"Yes mba, netijen IG horror because the play is rather frontal not suitable a little bully. Anyway, it doesn't agree with them, it's a really sin"
anger,"Where is the stereotyping from my statement? Try to show, who knows I am the wrong talking. It's good if many criticize. The more sounds the sound is heard for the truth, the better. If it is true but loud loudly the wrong one, that must be overcome. [URL]"
anger,"Interpreting a relationship, it takes many years and there are many lessons. Don't be needy if you become a girl. Your boyfriend has a future that he must prioritize. Your boyfriend also has a life other than you."
love,Her hair that has been and increasingly white. And his body and arms are no longer strong to guard you from danger. Papa has completed his duties.
anger,"Your friend who has stabbed you from BLKANG instead of Dialem2 if my mouth leaked had been fighting times you have the same thing, I am gabat."
happy,"Happy Birthday of the second Zein Dek, hopefully the long life will be smarter, more smart to be a child of Sholih devoted to the two old people of Nusa and the nation [URL]"
happy,"I have to even compete, so I am ambitious, DHDKDJDJ is always amazed by people who have a loud desire to achieve his goal ... because it means he is sure he is his goal and he doesn't play with his dreams. It's Mesmerizing."
sadness,"[Username] After five at the edge of the dusk court you give the code through the eyes of the eye. I had thought it was love, it turned out that Lara, after you said: ""Next week I get married, come yes"""
love,"Lean on my shoulders until you feel comfort, because it's a necessity for me to give you a sense of comfort"
happy,"Every time I listen to this song, I feel blessed by [Username]: "")) Yes blessed. Because I feel as if the bighit is hearing and answering my prayer to release this version of fake love song, thank you so much bighit"
love,for the love that has been present I want to give the best love that is not only because of God but also love that is always with God the last love of love without the end of love that is up to heaven
happy,"Subhanalloh ....... After testing the noodle children who have been khatam al Qur'an, read the short and smooth letter of the Regent: Baratt! Now you talk to the Regent, what prize do you want? Anything may, just talk later, the Regent Kasih. Student: I just a prize of prayer from the Regent"
anger,"Maybe the [username] is not healthy because of Persija fans? Not all the dangdut singers are the wobble. Via Vallen is polite, man! [URL]"
sadness,"We are just experiencing difficult times, dark periods, periods of vulnerable to separation. However, if we are able to survive, then it will not be able to separate. (Except Allah)"
anger,"Still stupid !!! He was punished or shot no problem and no one defeated ?? well, the obscene sibangsat runs away even though the one who defends 7 million is stupid. still don't dare to come back ?? Why??? If you think you think you know the answer [URL]"
sadness,"And the Ask FM content is just exciting with friends, there are no sex at all, answer the questions are also normal, but how come there are many who mention it like that, sad"
sadness,"11:45 pm, you have to be banging before 2:30 am, but instead you can't sleep & imagine the time again qualify time. always be one of the reasons for homesick"
