label,tweet
sadness,"Now I can't grin, it's still staying with the emot, why is it that if a sat we are rich, so I am happy :("
fear,"/ RLT/ Why do I accidentally contact eye with people (guys) foreign who look at me first, I immediately cynically, jutek face, actually afraid of being seen like that. I am in the proud girl? :("
happy,"After eating at Bumen, eating sausages even though Aliando BLG is full and he mesen sausage wants the size XL, the lucky is empty and finally the L. Gilalasehhhh you [username]"
fear,"Sadly when I was like this there was no 'trash can' so just arrived on Twitter sorry, my follower :( btw I was confused, we balanced 43.6 and then pup 2x after that it went down again so this is 42, what is the unstable scale what ????"
happy,"I want to imagine, if there are people who ask in the generation group I will answer even though I don't know, so take it easy to ask for something lazy to ask something in the generation because I'm afraid of being ignored if for example there is no answer, I will answer."
sadness,"The more modern your lifestyle, the more you produce plastic waste. Believe it or not. [Username] just try it a day if you eat, how many straws, plastic cups, plastic food you throw ?? #Haril environment of world life"
love,"Loving you sincerely, wading the ocean to get sacred love. Will never double you even though it's separated distance and difference."
fear,"I think after this, my eyes must be bathed using ash to be holy because I saw a scene that was not indecent in the MCD which was none other than the scene of people who were making each other in front of the eyes huhuuu"
happy,"gpp miss .. we exols going to keep waiting for us to know the difficulty to go to EXO ... Semagat Miss .. Fighting Aeris There is another time and we will meet URI EXO, don't be sad anymore"
love,"If the context likes it can still use alesan like yes I like him because he is handsome but if in the context of dear, I don't use alesan again. whatever [username] do that is what makes us fall in love with them for no reasons"
sadness,"Like the frogs in the shell, the high trust in the hegemony of science and technology as an apolitical pragmatic solution from various problems in Indonesia, is a form of the dogma of Google 'Scientism' Sila Google 'Arrogance Alumni ITB' eh"
sadness,"How many times have I told you, I don't force it to forget you. I gave up, I was resigned, I won't be able to forget dear ~"
fear,"The first time I see directly the appearance in this place. Will never forget for a lifetime! It turns out ... its history is indeed terrible. No wonder people who have never seen before, like I can see. try it there ..."
love,"I love them because they accept me as I am, it's good for me. And they are no drama. Very anti. When other people fight their friends, we have no problems at all. and believe or not We Never Fight."
sadness,"Sometimes likes to be sad to see the roads in ""remote"" areas built by the central government. Not providing pedestrian pisan."
anger,"If there are those who are people who are not possible to scream Rojali, don't ever accuse those of you who are not certain let alone stabbing relatives in Persija themselves. #JajaCacenya [URL]"
love,"Hopefully always healthy, and the most important thing is always love and love Ama [Username], even though I am a new followers but we can know each other because we are family we are families I love you"
fear,The relationship between Justin and Selena's hostel proves that the disconnected dating is not healthy. Afraid of being brought after marriage so JB marries another girl. Hu Hu
fear,"Where is there, eh there is ding but not ah, afraid here is vulnerable. If you just go out late, returned home to be crowded so vulnerable"
fear,"At 9 pm, sebioscope was only two of them, when the lights began to turn off the teaser coming soon the horror film when the devil picked up. laaahhh ... yes so excited serrr !!!"
fear,"I want to confide in here. I like to like kpop like to feel inferior with RL's friends even though there are my friends who like kpop too. Only sometimes uncomfortable with friends who talk to Stop Korea PLS Shel, and others."
anger,Anjir in Askmf. I want to be angry but I want to scroll again. Shucks. I'm trying to sleep right here DKSKDF starts to imagine now. wild boar.
happy,"There is no stop 2ny q saying thankful alhmdllh .... now I can ... the money is the committee to the alhmdllh, ​​then you have a brl ... mski not before inf."
sadness,"I miss last night. But the signal holds me. So I just continue this afternoon. [Username], I miss .. :("
sadness,"Lots of freshmen in campus, they don't know that college is not like a film film, all of it is happy. Later in college a month, immediately tangled face."
love,Proof that we love God is if we love our neighbors! Why do we have to have love and love our neighbors? Because God has loved us first.
anger,Dear [Username] Regarding this incident I beg Kai to take decisive action .. I always use the services of KA almost every month Gambir Semarang - Semarang Gambir Memongan with a very much you should wait under and permission to go down first ... 1 [URL]
love,"love is simple. Me and you, and nothing else. I'm for you, and you for me. The others only watch."
sadness,"Mr. boarding house soap opera in the living room. Caucasians continue to say ""continue to cry, why does Indonesia make the film crying so"" Emmm why do you think?"
happy,"I got a paradise in the world in my room, it feels like I really can heaven the hereafter. That's all because of Wifi. Thank you Telkom. The atmosphere is really heavenaaaa. I want my paradise to be like this in heaven. enaaaak. I have used hundreds of times wifi at home. use all Indonesian citizens"
love,"For me, when a partner can be invited to talk about many things and understand and understand each other without things ""hidden"" is a romantic definition of my version"
sadness,Pain does let go of the person we love but don't get me wrong more painful if we survive with the wrong person OUW! </3
fear,"Only able to retweet for enthusiasts of a scary story, look at it. I'm timid. If you look at the puppet kat, I heard the voice of me, just screaming even though it is closed"
anger,"well, I mean that which is abused verbally like the crew and sister Via Vallen can be as angry and after that, especially those who have arrived at the raped stage? yes so so that it doesn't arrive until the final stage whoever EMG must dare to speak up as much as the slightest acts of harassment. Let the PD perpetrators start thinking."
sadness,"So, it's better to stay, I just stay quiet -_- kepo deh, it was going to haha"
anger,"People say that just running it, don't be tired, because there are many types, different, I know what type of myself is. The person is easy to stress maximum. So, it's better if we prevent it from treating. Just Doloe's business"
love,hahaha bodo is very important in this video as a frame with danielsayang bangeet sm diaaaa and they [username]
happy,"I was chatting with Kiya Dek, pray mom, deck, so you can blablabla. Dek Kiya help pray. *nodding, smile "". Sincerely, his face. Even though he doesn't understand what is meant, but every time he says, he will smile, he must smile"" smbl hugs."
anger,"Regarding zoning is indeed controversy but to make SKTM PDHL capable and even have a car, it is outrageous. Imagine if the SKTM becomes a form of prayer and has been hastened. Besides, of course SJ is bad learning for children themselves, about the meaning of honesty"
happy,"O Allah, MHN gives the strength and health for those who carry out the task of #jumahdesa2018 Deputy Chair of the MPR [Username] and Mendes [Username] and Rombong and Masyracts to Ridhomu. aamiin3 [username] [Username] [Username] [Username] [Username] [Username] [URL]"
happy,"Cool!! Do you think there are still those who say sir [username] anti-Islam? 3.5 trillion, 142 hectares, so the Islamic referral campus of the world of Al-Azhar class. Not to mention the boarding school projects, madrasas, mosques and other Ummah facilities. if someone still says he is"
love,"As I used to love you, until forever without end, love does not need a reason to flow"
anger,"Not a typical person who must be played with chatting and continuing, I really are lazy too ... When you get time, it is a reply reply mine"
happy,"I want to cry but can't sink tears either from the morning want to smile so to carry the heart in the afternoon in the afternoon, it still feels easy"
anger,"[Username] Min what? The courier is sent wrong, instead to the address of people. how about the responsibility? Please respond as soon as possible. Thanks. [URL]"
sadness,"said one of the friends, and felt there was a point too. Nowadays good and close if there is a need, unless you know long. sometimes the one who knows it's been a long time too, hahaha"
fear,"Waiting for an explanation from the person concerned first ndul ... may be in CC ndul, I am afraid to get a cc later sprayed the person who claims to be the most dirty throughout the tuiter"
love,"From the beginning of knowing and loving you, this full heart full of love has chosen to continue to accept you however this situation. Injured is a choice ... and still loving is a gift and opportunity given by God."
love,who ~ miss you want to hug you want to be alone with you again I wait how come you're back love u dear [username] [url]
anger,"That's why I understand why Ms. Via Vallen is so angry when I get DM like that, and why is it bullied ??? More girls who are bullied, do they get DM like that, it is considered a praise, because if he is tempted, it means he is dancing? Ew."
fear,I want to complain but I'm afraid because I am afraid of being said not to be grateful to be very dying my job is just confide in the same angry but how come
anger,"So there is an acquaintance of me, I don't know, just connect, on the other hand there are those who pretend to be close to me, I have been close to you, I know, but if I don't welcone, I just want to go on it"
sadness,"5. The weather is always hot for this, I have to be grateful, in Sorong during fasting, it is diligent in rain even Bali is not as often as here. The days are usually not really hot. btw, even if it's hot, the air makes it fresh"
fear,"The fear of death is the most justified from all fear, because there is no risk of accidents for someone who is dead."
happy,"hey teenager, rise !!! This world is not only about love, self -esteem or fame. But about how we work, innovate, and build this country."
sadness,"Sometimes I miss. Missing when we get acquainted, miss when you always have time, and miss the laughter that we create on every chat. Yes Lord"
anger,The question that used to be upset at that time ... especially if Sodara is far from asking ... fortunately I don't ask back: when is the hospitalization?
anger,"Some are angry at the editing class. he said: ""I want to learn photography, not learning magic ..."" Truly, when we have designed the results. And editing is a part of perfecting designs that cannot be overcome when photographing, because of various things .."
sadness,"That's lost. What you should learn various theories about social, here you are given a variety of numbers and formulas that make it uncomfortable, and the fall instead becomes the most left in class."
sadness,"Tonight, when you are cornered choosing a road. get DM like this: if there is an intention immediately carried out ... the question will be delayed the same as not so it is usually time then I"
anger,[Username] [Username] [Username] [Username] The problem is money for consumption of breaking the fast with orphans that must be paid to the catering ..
sadness,I'm tired I'm bored I am bored
anger,"They are very worried about the full support of NU to the president [username] so that they are trying to tinker and delegitimacy is the term Nusantara Islam that was introduced and developed by NU since the 2015 Conference. So the problem is not religion, but politics"
anger,"MLZ is the most if you have been talking about comments etc. I think it's really holy over the bottom but zonk :)) ntr if the answer is ""migrating is easy, the istiqomah is difficult"" Iyee understands, the point is that the hijab is so seasonal? to the mall? Clubbing? . *curhatan full*sorry"
sadness,Astagah! The nature of the Humoris Scorpio is a mask to cover all the wounds of his life #kiscorp
sadness,"So, I guess the reports written by even international institutions will be congested. but it turns out not too, coy! The contents can also be awesome and not logical. The data can be correct, but the interpretation is not."
anger,What social inequality? your eyes. Kampret Model you always turn the true facts. to stupid thinking !!!!
happy,"At that time the three of us, selected from around 300 people who registered. Yes, how come we don't feel proud that our workshop is taught by Fajar Arcana, Agus Noor, and Semo Gumira Ajidarma. #WorkshopcerPenkompas2015 #TSYGMC Photo: (Still) [Username] [URL]"
love,"I can't say much because what else do I want to say? I've been speechless because it's so unfortunately you are, huh. In essence, I love you all. Judy too! I want all of us to be more compact in the future. Amen!"
sadness,"There is no intention to weaken the Islamic state in general, but the unity of the Islamic nation when it came true, and I see that the Turkish with his erdogan has done, but not enough, I as a Muslim see it is outrageous that is carried out by Israel Laknatullah, [URL]"
happy,"Then he replied 'what are you afraid? Just say og ngg: ') The father passed. And I'm still amazed until now. He was not as evil as drawn in my previous tweet series. He just needed me and my friend talking. He wants to know, what is our problem?"
love,"this afternoon, I dreamed Bang Tomi. At that dream I and Bang Tomi looked close ... really, bang Tomi embraced my shoulder tightly ... really, yes ... the meaning of that dream ... ???"
sadness,"Trying to make a pudding experiment 1, wrong making it turns out that I made the jelly nutrijell experiment 2, I made me layered with jelly it turned out to be a plain experiment 3, making it layered again turned out to be mixed because it was not hard. what's wrong and my dosen dosen :("
love,"Even though you erased myself to change my love all unable to get rid of the love you have given ~ Even though you changed, I survived throughout my time let me love you in my way"
anger,Kapooook I won't want to meet SM.EPUPU BANGSAAAT AJRIT Corruption fraudsters just doubtfully shirking.
anger,"[Username] Already far better, at least the Speaker of the DPR dared to be arrested, compared to before, members of the House of Representatives, Governors, until the RT dares to be corrupt without anyone daring to catch"
happy,"Alhamdulillah, 3 & 30 July is Our Happy Day. [Username] Congratss My Sissyy. Although Gadapet SNM but there is another way to achieve our dreams. Even though our SNM is red and crying a hug together eh it turns out to be back again in the one of our SNM choices."
happy,"I am very happy to hear that congratted the trial will be waiting for the graduation, there are those who are coupled with Yuhoee"
sadness,"who want S2 but it feels very difficult to achieve it. Those who have gotten an easy road to S2 even don't want to. O Allah, how come this is the world you created?"
happy,Indeed there is no human being the most correct in his actions. but there are always humans who are able to be right after understanding ever wrong and not always blame here and there with their passions
anger,"If you can't, just accept it. This even grumbling it is not clear then gathering in front of the barrier. Make a traffic jam. What makes it complicated is that young people and their fathers are somewhat cell and immediately receive information well and do not treak clear. ky the original market earlier"
love,"really cool I swear I want to cry, the cool thing is that I really love you, don't forget to stream AROHA"
happy,"I am serious, even if the username [username] will lose later, I better lose to Yusril than Prabowo but it can't possibly lose ... hahaha [URL]"
anger,[Username] [Username] [Username] Already similar to the sodara of the dog you cuuk jancuk hahahaha it is not a group of bills and people hahahaha
anger,"Change President? Who is afraid ... who is the candidate? what is the onoh? Uh, not syudih"
sadness,"when I want to arrive, remember the task of B indo mtk economics -_-"
sadness,"So the location is right in the middle of Segara Anakan who is covered with mangroves, if during the daytime school the rise of sea water, so school children usually come home off their shoes. Sadly seeing him, as well as slap myself personally [URL]"
happy,"just positive thinking ... the sweetness is sweet, there is no milk ... there must be a milk ... the same as 2019, the president ... there's no president, right?"
happy,"where to understand, you understand Go-Pay Tea ... already buy a funny Eid envelope, fill in the new money, it's the most correct ..."
love,"Love is great, even greater than the world of marriage. Prayer is a part of love for an ideal that we have not achieved."
sadness,"Yes Gusti, what's the one trying to be really stuck in the nutmeg. it is really spoiled ~ again want to be held up ~ it's really beautiful ~ but not pretentious beautiful ~"
sadness,"If today your heart is torn with other people's actions, then it could be ... that's the way God elevates you after you let go of all arrogant and admit your mistakes. No need to forgive them, but forgive yourself first"
sadness,"Changing the habits of someone who is not good ... heavy, must be strengthened. If it doesn't change either, let's just give up. Maybe you can't change it."
anger,"well, you know ... what is staying up will correct and advance the area, instead, just order goods abroad, the results of the local people's crafts are good, I don't understand, I just turn it out, if you don't know, if the shop next to a little ""spicy"" the mouth is just silent"
anger,"I swear by me, I just become a guy, embarrassed, I want to be invited to the chesecake factory a lalalayeyeyeyeye"
sadness,Ahok was in jail ... his wife was stradd out by a seven -year -old person ... now even the quote of plastic trees too ... sorry for his fate
happy,"You have never felt it, how it feels to call people for hours, videocall every night, share with them even though nobody and he always takes time to ask how Was Ur Day is as busy as he is."
happy,"Bismillah Greetings Plur Slankers/i Indonesia We will meet at a very awaited moment - later by all of us. . . ""Slankers Indonesia National Jamboree with Slank 2018"""
fear,"So I remember once I was riding a car that drove, I sat next to him. Then through a small road, right, it's narrow, then I open the glass because the left is there, Mas2 is standing. his name is a small road, I'm afraid he is hazardous"
love,"I'm not easy to love, I'm not easy to confess I love, I'm not easy, saying I'm in love. My senandung is only for love, my penance is only for you, there is no lies my oath of love, until I close my eyes. Let it be like the sky, you look at every day, tightness cannot be owned. I let it be like the sky, if I like to give dusk, if I give sorrow."
love,My friend's name is Helen. When Shi yesterday he deliberately went to the airport for me because I could not come Shi and he was willing to be his Masternim Day6 dear huhuhu [URL]
fear,"Gilasih, some days ago I saw a big truck filled with SM 3 org. Tmn I can't if the truck filled with SM 3 people is in the middle of a corpse. The original goosebumps are really going on when it's sunset and I'm alone coy, scary."
happy,"Don't depend on luck. Happy and not happy your life depends on your hard work. - Tulus, masterpiece. my favorite song. so that you don't lazy: ')"
fear,This is 422 -_- I don't dare to go out for the Manasin of Siska's water that is' something. indeed your apple is Siska !!! scared
love,[Username] He is a human who suddenly seized attention because I thought he was a calm person.
sadness,"On this day of limitations, what do you learn? We have to face swiftly, it is not easy to live this story. On this day of limitations, take the spirit of the heart. Everything you trust, guide your steps to go home here"
happy,Okay (y) check fav ka :)
love,If Kasmaran is narcotics. then you are the dealer. And I am like an addict who is willing to mortgage the soul to look at your eyes once again. Time line [Username] want to be a person's name. It's just ... ah never mind
happy,"Laptop has 6 years old, durable hours until 3 years old"
sadness,Gasabar :( okay thanks mimin: D yes around Indonesian time yes
happy,"#oldmoneygodg Nongkin hanging out in front of the house with friends, every time there is a motorbike passing in terrain Woy Standaar when the person looks hiding :))"
happy,"God with all the designs and plans for goodness, I am grateful for the apada, both difficult and happy always spirit"
anger,[Username] [Username] Alumni practice in the campus for whose permission? It must be asked for permission first because alumni use state facilities for their own interests must be the knowledge of campus authorities.
fear,"Buy makeup once, if it doesn't suit it, it makes it even make a decree and spotty. Then the treatment for days. Yagitu what makes voters really makeup: ') just traumatized a sensitive face like this."
sadness,"#Bali, wait for Koko again. Koko will come back again and stay more long there. back now is the story? Hmm .. Alright. #instabali #kangenbali"
anger,"Huh! Is this right ?? if right, astagfirullah ... masha Allah ... naudzubillahminzaliq !!! Islamic Party ... Allah's party. His behavior ... Setaan !!! [URL]"
sadness,"Vacation to Jakarta is finished. have to return to Japan again. Then grin. 'I can still re-schedule tickets. Still not back. ' 'Reschedule pays again.' 'Yes, Gpp. Still miss home miss mama papa brother, you ... ""love the money. can be saved 'he sulking"
anger,Even though the others smiled friendly with his fans. Only you are a bit arrogant !! Rodo Ngadoh Piee Ngono Nek No Rasakne Oath Wagu Mas Polahmu
happy,"a place to lean and more silent, silent in the sense of forgetting while all the hustle paths that exist such as work and congestion, and a place to meet a smile that you will not get in any place. [URL]"
sadness,"[Username] [Username] [Username] that's how they are. . . True saying the saying ""Drought a year is removed a day"" very sad this country. . . actually for a certain interest. . ."
love,"This longing starts to melt, soon yawning. Hug love, tight. resigned as if our souls were carried away. ~ Give. #twittmalam #twitttrindu"
love,"My best friend, is in Ava. G, innocent, but he is good to use it, care, really funny, clever too. love her"
sadness,"Besides, aren't you tired of being weak? In my opinion, it is even more tired so that people are weak than people. Because yes, the person is weak, the mind is negative, but it is different from the strong people. Whereas it's already proven if we think about negative things can have a negative impact too?"
anger,"The matter of dowry is the business of your party, don't bring Islam, sir ... Islam is a beautiful religion and peaceful love. Do you look for a dowry party?"
fear,"Well ... what I'm afraid of is, bro. Later in the political wrapped in religion. That's the danger, so that our society is sensitive to it."
anger,"[Username] [Username] The government should be a public servant in charge of making its people prosperous ... Which will give the punishment, soon In Syaa Allaah SWT. [URL]"
sadness,"Maybe Allah pinched me with his test. Maybe God is longing, longing for my groaning, longing for my prostration, longing for my praise to him. Or it could be God is jealous, because I love and miss you (my man)."
love,"Intinnya congratulations on the 25th for the 3rd time, never expect strange ones, I just want to keep on with you. Unfortunately you have never changed to me, so unfortunately I will go to you. Hoping can even be more affectionate to you over time."
sadness,"Wkwk, right? It's like slipping a message in the tears more than the laughter of laughter. So whenever you think, why don't you write it away -until the puppeteer, the last dialogue that did not have time to be engraved by DID"
happy,"Finally I put the Thamrin until I was dizzy, I looked around. And Yu Kno Wat? There are so many Koko Bomber Shirt Jacket Shirt Jacket T -shirts Caup2 really bwt Brondong and former W."
fear,"[Username] What? I usually use shopee if anything, traumatized by being cheated by hundreds of thousands ... just try the real ID card, or not the ATM account, if you are cheated, just report to the police ... yes not anyway/?"
anger,"reporters killed by teachers killed by activists killed, someone killed, dozens of people were killed, dozens of people were killed, hundreds of people were killed, thousands ."
anger,"The brancter who plays the claim is usually only in the ribbon scissors, but it is considered the pemuji building from the beginning #nomation #cakilrakyat"
sadness,"sometimes remember that this interest first is a BPOM employee, until I have taken UMB at UNJ majoring in Pure Chemistry, but what is the power to enter it in Gunadarma, Boro2 becomes IT staff, the work is far abis, hahahaha and now work interest in the lab emerges again but it's late siiiiss"
anger,[Username] I am disappointed with my akulaku .. it's been 4 days to register but not at acc .. said CS told to use a new number ... still not at acc .. today I replace 3 times the number is still not at acc .. is it already in Close for new customers ??
love,"Like a girl different class, I was in grade 7a at that time and the 7C girl if I didn't forget (for you to love my first)"
