label,tweet
sadness,"how come this mlm suddenly feels miss ... I want to walk while holding his hand, .. I want to hug him and say that ""I miss"", .. I want to cry on his shoulder and say ""don't leave Aq"" .. God please tell him"
fear,"Huaaaa, I am afraid that I am an acute timid. severe shock. shouting can be the most fast time. Thanks Ojan, Ibad, Haekal, Imam who made me afraid of this night"
happy,"I always wait in the morning where humans send short messages whose contents are always the same ""What today there is homework?"" at around 07.30. With proud I feel the only girl of his trust in school, moreover he is sring curh mslh."
anger,"[Username] No need to explain, sir. Let me be the one who is looking for his own news. Even though the chronological gimane was explained by the Bantul Nye himself. it's really a bad brain"
fear,[Username] Never and will never trust that kind of application. Like those who read the article and continue to get money too. we enter personal data and no. Rek too right? Isn't it dangerous. Don't be easily tempted by things like this ...
fear,"Well, since then I began to feel afraid to establish a relationship again. I'm afraid in Boy I swear. Very traumatized."
love,Affection is the greatest gift in life especially if you already have people who want to give it sincerely and sincerely to yourself.
anger,"Legitimate you are a Persija fan. Defending favorite club players. Although Persija bapuk. But don't really look, especially about Via Vallen & Simic. think !!"
sadness,I think life without the soul of a poor or rich person is equally fierce about treasure like an animal in the jungle (nocturno) #falsong
anger,"The person who failed in the past means that the person is the most hated by God, because his brain is leaking a leak of followers, but the brain is moter2 [username] [username] [username]"
fear,"[Username] given wasp oil so day later it will be left until it mateng, if it's already just been put on it so that the blood is dirty, all of them are horrified ..."
sadness,"yes the problem he wants to enter the religious blasphemy party is the right of his choice ... who is unfortunately, not need to carry the name of Allah and carry the name must be"
happy,"Four years ago, when the people of hepi because of the work/school again, I was hepi because my name appeared on this list: ') #WorkshopcerPenkompas2014 #TSYGMC Photo: [Username] [URL]"
anger,"[Username] Attacking fansite told Take Down all photos during the concert. Until telling fansite just closed. If the fansite is closed, the source of the ATM is also closed hahaha."
happy,Do you know the most cool event? our children's fun event later [Username] [Username] #Inisahurtiketcomharike20
fear,"Dek, I'm just afraid, my feelings will exceed the limit as a senior. Stop? Even though the reason you informed me was because you were bored."
fear,"For some reason, he was scary to ride the night krl night due to the story of his mom if his sister -in -law had taken a ghost krl (ghost train like that) from ST. Lenteng Agung to St. Tebet. Well, but that was the year before the KRL was air-conditioned."
fear,"Friend, Duren Sawit, said that I just made Indomie Sante Bae but then I foolishly scroll timeline and found a photo of Pocong and Suzanna that made me afraid"
sadness,"I was the real there, who was bundled green, just close friends, aka just confide in the contents of Twitter because I invisible here"
sadness,"I don't like being happy with thieves. It's just that I'm not happy if the thief is beaten until it is really bony, especially to be burned and killed."
happy,"exactly. The family of the mother who was converted from Menado and Eastern Indonesia, so the Christian, from childhood, they used to come and love their time for Easter and Natance. And they have never been absent if we are Eid, surely the 2nd Sowan Eid group"
sadness,Let them curse. There is one thing I want to ask. There is a desperate place of singer. who have hurt humans to save their beliefs.
sadness,"[Username] Yes. I can't like GT to people. So I don't know that too. If he wants me to be my food, I better buy him the same as long as I don't take mine."
sadness,"Yesterday I saw Lamtur talking about the problematic BNI bank. Initially it was ignored, but it was very concerned that after today the salary money came out, but the time was checked, instead it was only 2.5 percent of the salary that had to come out #bni46"
sadness,"[Username] Hopefully it is true because the dignity of a habib must be guarded by many followers who are willing, let's just in defending his lord, especially if he wants to be a presidential candidate who must be ready mentally because it is not possible to win"
happy,"Leave a greeting for Masbro [Username] if shooting bring bamboo, so it is not to make it so that it doesn't work."
fear,"Monday qerja overtime like a quuda. Be careful, for motorists, the motorists check the helmet, who knows, there are spare insects or cockroaches or cockroaches"
happy,[Username] [Username] Eating crackers don't be noisy wearing pants don't fit sleeping sleepy eyes but still cool there is @8rianna
love,"[1] Welcome to the first 20 of the first, it doesn't feel like you meet again the 20th ladder oppa still feels ""just shot"" Yerim yesterday, many of us then then made us closer and the reefs grew dear"
sadness,Innalillahi wa inna ilaihi raji'un. Please pray for friends. His father [username] just died. Hopefully all his sins and his family will be forgiven with sincerity and strength. aamiin yaa rabalallaamiin.
fear,"Vertical transmission is 95%. Wow, so scary ... that's why pregnant women must continue to keep their babies and horizontally 5%"
love,"For you, a woman who I always go on. Be happy with your age. I hope you are healthy, hopefully you will awake your faith and Islam. Maintain your happiness, my lover will be calm because I love you in silence. I love you until the end of my hdp"
sadness,"I'm confused why to be a fan must bring down other people's idols? Why not just peaceful, there is no work to fall on others"
fear,"/RLT who studying in English Literature majoring in English, tell me in that department to learn anything. want to enter English literature, but afraid of not according to the ability :("
anger,Pancasila was incuited THR forced education to be sold by the brain in the campus of Disatronin 2 periods. #Batalin2PERIode [URL]
fear,"It's a bit strange last night Burhan cigarettes are left in the motorcycle dashboard then what I don't do what I put again, then the meal comes out ma iffa to Motekar eh behind the cigarette gada. really strange, even though the parking welds in the photochemot are also the motorbike"
sadness,"Iftar, just drink the same as eating fried foods, then midnight eating cayenne pepper meatballs 3 tablespoons more, after that the stomach immediately wrapped around"
happy,"[Username] Surely many have not read Manganese and feel that this amrrik remake is like a power (cuih) that has just been released, even though the manga is great bro, and it is honest"
happy,"[Username] Iyeee Bik, here Joke Dime is not a problem, instead makes stress disappear, try on Instagram, oh okay really netijen with all the comments?"
happy,very tasty especially belin w meatballs: D Eating spicy meatballs is very tasty
anger,"Ade: bro, have you eaten? Gw: (Wow, I ask for it yet) not yet, just eat first: I mean the cat has eaten what I haven't been: etim you see a place to eat. indeed"
anger,"4. When I was sent back, the courier was complained and mager to go to the right address. In fact, asking to meet at the point he knew that he was not difficult (no puter back, must be in the same direction as the direction of the vehicle he walked)"
anger,"This BRI queue can be to wash clothes, iron the hijab until it is taper, make compote for breaking the fast, see the video of tasya farasya unboxing, make fried tempeh dough, choose a store to see the price comparison of marjan syrup."
happy,"Apart from the doctor's cream, aka clinical cream and thank God, there is no irritation or anything that tyda wants, which is important if you want to use Sunscreen BEP"
sadness,"Rangorang is busy thinking about Nastar, I'm still thinking about how this needle automatic microneedling hasn't come, apparently im so behind at Lebaran culture. as if Eating Nastar is Religous Moment"
happy,"I am very happy to be able to share happiness with road users & also our brothers who run fasting not only sharing tajil & food to break the fast, but there is also the appearance of JNE Idol and Freestyle Ball to entertain the people's time when the red light [URL]"
anger,"Strange ... there is a woman abused and fighting, instead bullied ... this is what is ... but it is her turn or her mother, her sister is abused ... her rampage is like possessed by demons in the hell. and the bully of the victims of the many women too .. #ajaib #savewoman #saveviavalen"
love,"Good love must also be able to make you better than before. If your love makes your life worse, then don't be afraid to let it go away."
sadness,"If you often interaction with people, I really want to go back and forth themselves alone in the room and then drift in the fantasy. But if it's already alone in the room, how come I feel alone and don't have friends."
love,"Actually not me who chose you, not also love that chooses you, but the Creator who chooses you to love [Username] [URL]"
anger,"As a supporter of someone just, I do not forget the memory of not looking for a face, I brought face with memory .. Boss Be careful in front of fire or a cliff that can be harmful ... skill"
sadness,"Hello [Username] Please help, yes, I have given up with my complaint at the Sabang Branch Office in Central Jakarta ... I report on May 2, 2018, where the problem is when the cash withdraws is debited but the money is not out. He said 14 working days but until now zero"
love,"I miss your whisper in my ear while you say ""I hope some one day you become a useful child for many people and hopefully you always love us your parents""."
anger,"In the past, I was called the name of a girl who was just like the trembling of the pantokhir test, now if you don't say he doesn't love, he realizes that he is a girl who tries to die in his father's happy Oldmoney or feel"
anger,"If you want to save BUMN finances, submit the BUMN governance to the private sector. Instead of rich now, the average directors are filled with political party dolls."
sadness,hehe yes still sick FIR -_-
happy,my inability not to cry and think it is difficult ... as difficult as calm this heart ..
sadness,"that is troublesome if you just read without understood, well there is an error, not understanding ... selective to the argument not daddy, while reasoning remains on the track, not off the track, if it has been left out"
love,"Ekhem Test Test One Two. Hello dear I'm the most handsome phirel couple. If you are the couple, let's see this."
love,"Beautiful [username] immediately sleep yes you, reply to the time tomorrow. who asked Peje just gave Coki Coki .. I love you baby"
happy,"Yha is really a word ko Ernest. I saved me every month, min really had to be 1 million, for Kulyah Cyn, it was heavy at first, but I used to get used to it for a long time. Oh yeah, the same lifestyle is also affected. Luckily I don't like Nongki2 haha"
anger,"You call ""Bumi Pancasila""? Ustadz you call, ""Buttcina"". Democracy = Thoghut. brain"
sadness,"Sometimes care and excessive motivation is hurt. Approximately it doesn't go, okay. Up to you. If it's already disappointed, it will be very bodo. Serious. Set yourself"
sadness,"I used to buy shopee using a manual ATM as long as it matches the amount in automatic verification, eh this is comfortable so you use a cousin account, I don't even automatically the order is disadvantaged, God mali"
sadness,"Yes, you know, also understand that the name of separation is not good ... but depends on how we react to it ... and don't have to hate ... especially with those who are not wrong what ... enough with an attitude like that. Again."
happy,"The first time I met when the baby was 3 months old and now 6 taon grade 1 elementary school, time so fast ... his name is Raditya who has aspirations to become a firefighter. clever yo le sekohale"
fear,"How come I was horrified to read it ... my mother also said that, the effect was to the eyes. so it's better not to bother."
happy,"[Username] Good afternoon, Post Friends. The shipment has been received, friend. Thank you for entrusting and using our services :) ^FD [URL]"
sadness,The highest longing level of the girl likes to sulk not clear. if often sulking means miss you miss it. but unfortunately that guy sometimes is sensitive .....
anger,Haiyaa merchandise Lu Olang rich IM ISIS HTI does not sell a ... [Username] [Username] [Username] [Username] [Username] #2019Blippks. [Username] [Username] [Username] [Username] [Username] [Username] [Username] [Username] [Username] [Username] [URL]
happy,"[Username] Not only educated ... but so a wife who is able to be, good friend, lover and also a good wife towards her husband. In shaa Allah ... the intention of the good nuha, will get instructions from Allah SWT."
love,"What is Jyoti's figure? why can I be your secret admire? I like your ""typing"", really people say if anymore bucin anymore in Sukain. but seriously, I like you to go on your typing to people"
fear,"And at that time the only one who took care of me. honestly deg2an, scared, panic because they have to have a relaxing financial bureau that is fierce. cm can reckless capital just to talk to the bureaucracy and a little telephone that I consider to know everything about this."
anger,"When the one who is catfish in you is your own mom, the photo wa he never uses his own photo always uses my photo. Many clients are suddenly odd, suddenly invited to meet, even though I just boro2 there was a mode"
anger,"Whatever the form of harassment is still harassment, ""it's just like that"" ""Yes, it's used to it,"" realized the Calling Calling, including harassment"
sadness,"can't love :( unless the S1 child wants to go to S2 Psychology can still, but cmn can some Psychology. At most take HR Psychology. If you take clinical psychology, it must be from S1 again :( Clinical Psychology must be basic psychology"
happy,used to be like almost half an hour or 2*x sessions explain Korean words*cie*... until I use it in the biat it is connected ... finally just understand and find the equivalent of the word to korea ... then now I forget the chores cie what hahahhaa [url]
fear,[Username] The pling childhood that was remembered for the school was taken by my mother because he was afraid of schools and had to buy candy and so I would like to get to the gt dech scra.
happy,"Soon we will meet the krucil-krucil nieces who are very annoying, like to ask to play fighting. It's fun even though the risk of the pegels later, little by little while teaching counting so that #Jadil is better when entering school"
happy,"How delicious the goat satay is because of the burning of embers with spices to cap no one ... eat enough for the sweat of the body ... excessively makes high blood pressure, cold sweat can modeled the steering wheel"
happy,20180710 #3 09.06 WIB Finally Socialite Gang Kumpuulllll Breakfast Syantikek from TBS and Kelapa Gading #Holiday #Breakfast #Syantik #Pizzahut #Juanda #Jakarta #Indonesia #Tuesday
sadness,Back to Maba Lyfe. At this hour just returned to the boarding house. motor. alone. dark streets. quiet. afraid but you have to be brave. yallah like this last week of lecture quat quat quattttt!
anger,"Don't play with SARA. Those who play with SARA let alone approach the political year, almost can be in the end of the conflict. [URL]"
happy,yes the struggle of plugs to all: D in the karokean tuker2an snacks wkwk
fear,always afraid if you know that I after shopping even though shopping also uses your own savings cm if you've grumble
anger,"[Username] I want to ask, sorry why my Telkomsel number is ""emergency call"" there is no network even though Telkomsel has a network. I've tried to change the other card"
sadness,Really love you so hard. Separate with you especially. #HadiahThe Feeds - [Username] Always make baper but successfully forget hungry. [URL]
happy,"Btw, salute to anyone who made ad topopedia who told me the past about saving for shrimp to eat. With a pretty simple narrative but can immediately hit the Emotionally Cave. Well done"
happy,"Alhamdulillah 'ala Kulli Haal, Jazakumullah NTK Pak Arief and Mr. Basyit for guidance, direction, graffiti, revisions, scolding etc. for 1 semester. Always healthy, sir. keep inspiring. #LATEPOST"
anger,"[Username] [Username] You are also included, sis. Don't mention people other than you are nitijen2, if you are still in the part in it. Bukber?! in this economy?!"
fear,Hepatitis B 100x is more infectious than HIV/AIDS duhh scary! And there is no cure.
happy,[Username] [Username] [Username] [Username] Who does not recognize that Aher is GUB.
sadness,"Fasting this year feels really less solemn, the tarawih prayer of the Koran can be counted by the fingers how many times, even though not of course next year can feel again ( * again vent * but still not the Koran instead of Twitter *:"
sadness,"Everything seemed to be destroyed instantly with a photo. . . . . . . . . . . . . . . . . . . And in the end, I could not understand the meaning of the photo"
anger,"Addeh, Mas and Bpk, once again Via Vallen is only a victim, who must be speak up so as not to be repeated. As a form of spread awareness as well as punishment for anyone who is nagging him spy stop. If you are harassed like that, just stay still? How do the perpetrators want to stop [url]"
sadness,"Read IIM Replyan so thinking again, saving this month to set the target to watch Persib and buy ORI jersey next month. don't think about the future if there is no Mr. I might ask Mas who incidentally already married. It's not good with his wife hmmmm. My brain is very shallow hehehehe"
love,"Wow, my piyik is Nanami, I love, I love, proud to you, dear, dear, the deep voicen is good, yeah, it's funny"
anger,"Yes, what's wrong with Ms. Ms. Re -shared, Postan Mu Iku in the group has been far away. Send this photo of the photo, you know yourself. I am excited, Ms. Karo Koe."
love,"A good boyfriend is a girlfriend who advises you never yelled, but with gentle & affection while smiling & staring at your eyes"
fear,"Give Tehaer to the nephew. Shirts of two seeds of pants pants koko sestel and jacket sebiji already more than half a million. Message: If you have not been able to financially, think about having a child again."
sadness,"Asked by friends to help wrap a gift for his wife as a wedding birthday gift. Continue to be told to also slip a romantic quote. I am an expert, he said. In your heart grimace, you know :)"
sadness,"[Username] Not long ago, he said that he was sad to see his friends experience a hard time. And even they don't want to chat because they are worried that if someone doesn't reply, it will hurt feelings. Soft you know: ')"
love,Love that is actually love is ... when Sayyidina Ali Karromallahu Wajhah Sleep replacing the Messenger of Allah
anger,"On Instagram hits, hype is severe, chuckle, followers a lot of handsome cute, making a diligent story. but it was the turn of the photo of him after his run to me, inviting hunting here and there, right?"
happy,"queued at the Situasyen Bank: Miss did you get the queue number? 227 Buk, just take the queue number so that it is fast --- 200 * in hati * good child fortune"
sadness,"Last years once a month passed Malino when climbing. Now like that I can't achieve this place anymore, hahah. Finally here 19 July 2017. [URL]"
happy,hahaha it's true that you continue to be immoral: p
anger,"If you become a girl Jan Kepo, why! Dweelah Apansi Ha Apan O Enough"
anger,Why not ask for UMKM Jakarta to produce trash cans from Stainles Steel? He said he wanted to reduce unemployment. more than 9 billion was given to Germany & GT
happy,"It is true that I will bong again, wakaka"
anger,"Those who like to eat shark fins sink or not mom [username]? The fish is as big as Metromini, only on the fins of the fins. eat the body too please"
anger,"The recording is crushed, the brain squats, pretentiously smart"
happy,"Alhamdulillah, two days penetrated Rp 100 million. Thank you all friends. Hopefully the target will be fulfilled soon, and Fariz BS will be operated on soon"
happy,statement [username] directly God pays cash .. Thank you O Allah who mastered human shame .. Explain .. Explain .. [URL]
anger,"[Username] PPDB System When the school choices 3 are correct as DKI, KNP 2 Choices are uniformed throughout the provinces, the achievement path is proven by registered with the Education Office, there must be a barcot"
happy,"Hepibesdey mbaak cananeeeekk [username] long life, always healthy and noble and become a much better person but still metel yee but don't be a person"
anger,"Dear [Username] Is there no system that detects to update the change in postage price? Udh Tahun 2018, NOMBOK continues every time you send a package because the postage is not appropriate."
anger,"okay this is the first and the last time to go to the kemotel not wearing bathing with flip -flops and already like a trash, already up to the hotel told to go up the stairs, and the upset is the elevator there why told to go up the stairs ?? fortunately again this fast, sis"
happy,Lorenzo is quite satisfied to be able to do something Rossi can't. namely champion with Ducati. Next year to Honda to win in 3 manufacturers. Thank God you can win the world again.
anger,[Username] [Username] [Username] Just check which certificate is not able and which statement is not ashamed [Username]
love,"Just saw and really listened carefully Nissa with her Sabyan who was on the rise. The original is not damaged, the sound of a clear flawless is really like a glass glass after washed using s*unlight so it is clean shining like that. amazed."
anger,"Why is this so the impression is Via Vallen vs Persija anyway? ? This is a woman vs. Sexual Harassment OII. Don't even make the impression Persija supports sexual harassment. Simic is indeed inconsequential and deserves to get a reward, but I'm sure his career will not be disturbed. Uno, still the Deputy Governor, right?"
anger,"The way, let's go with the same sampek 12windu again or more ... but it's the turn now on chat, not reply, on the phone on reject, invited to meet you are busy ... just there are millions It's not hard ... Classic is really anxious"
fear,"Almighty Dahsyah Allah who created dreams in such detail, ended the time and date visible, the heartbeat felt until he woke up and then felt the fear that came from the dream"
fear,"Tomorrow you've started working, you will be afraid of getting waking up, I will start working at 6 am, until you make alarm like this, afraid you can't wake up Pffft. [URL]"
anger,"This is how the man who is ""Satan"" ... He considers himself ""God"" and the most correct in practicing religion."
love,"[Username] Loving Jaewon can, love Jaewon can, so Bucin Jaewon can, so a good wife for Jaewon can, just request what he wants"
happy,"[Username] Hopefully his enormous service for Indonesia, still remembered and flowed for the next generation of the nation .... Aamiin"
sadness,How could dirty deeds and words make your heart clean. And how could dirty words come out of a clear heart? [Allamah Thabathabai]
sadness,"Who did that to me? Yes, friends who most are women too. It's not surprising to see women who are loses by fellow women. I experienced"
anger,"The intention of the heart wants to Regis SIM Card, already finished entering the NIK number, eh there is instead there is a KK number. How do I know it ... I really hold it, I am the one who saved. Why does it have to be kk?"
anger,"[Username] Yes, on DM via Twitter, I was very much looking at. Actually, you can just ask to delete concert photos or Sue if they don't want to. Macem Jelpi. But if you tell you to close it, stupid."
love,"Shouting your name in the rain, looking at you from a distance, and praying in the quiet silence. This love in silence is what I can maintain."
fear,"Seeing the photo alone makes you horrified, let alone experience your own goosebumps ... as if death is in sight"
happy,Savior when hungry is just a pop noodle friend. It's good to make it collect and doesn't make baper. That's why Kuy pursed pop noodles from now so that he continued to continue [URL]
happy,"[Username] @8rianna_ To be present min, my greetings in the Salsa Icikiwir segment asked to be long read yes [Username] [Username] [Username] Thanks!"
fear,"I am not wrong if you ask for PD [Username], immediately order the Minister of Health to add a special room for ""mental illness"" at every time it is sick. SBAB, it does not rule out the possibility, after the presidential election, every time he will be flooded with ""mental illness"" patients. The signs towards that are there. Nowadays many are stressed [URL]"
happy,Happy working p. Ganjar [Username] Make Central Java more like that when can this be able to ride together again ?? can be celebrated with 2 notes & together. Happy!!! Happy. Happy
sadness,"Well, give him a new girlfriend, who is a gemati who is not stingy who wants to pay a meal that likes to invite first that is not fussy. Let his heart hurt. Amen"
anger,"When sexual harrassment is a hot topoc in all social media. Starting with SM YUCUB, Mba Gitasav's opinion, the Gitasav scandal that is crowded until the Twitter account is doseactive, and ends with Ms. Via Vallen who blow up to chat doi Sam Sam Bule. still not sold out thinking with people who talk:"
