label,tweet
love,"Maybe when I was a child, Mama was the one who asked you more often to tell stories or ordered. But did you know that after returning Papa worked and with Papa's tired face always asked Mama about your news and what you did all day."
happy,The first bukber with my dear person ... [Username] [Username] [Username] [Username] Syngx Less [Username] and [Username]
fear,"So a kind of motivation is like that, want to oversee the election is really by becoming a TPS supervisor. escorting the sound, don't have cheating. Moreover, the elections in Tmarahang are very vulnerable. well so a single candidate ................."
sadness,"For days to sleep at 1 hour 2 and continue. I think it's just an innate, I can't sleep quickly, I don't know why even though it's tired but it's just like I can't sleep"
happy,"Mas Metal, the program from [Username] and [Username] makes young people nowadays young people who are creative and open [Username]"
love,"When you are sick with colds, Papa is always worried that sometimes a little snapped by saying ""you have said! Don't drink cold water"" In contrast to Mama who pays attention and advising you gently, ""Know the nutmeg really worry about your situation"""
anger,"If the business should have eaten domestic money and keep on going, it's stopped and finding other businesses, or looking for other ideas. or reducing operational costs. For example selling online first. It can be after the kingdom if domestic money is one together with business money."
happy,"The mission of Mas Hasan Ngeamen 'you make me feel the beauty of falling in love with loved when you become mine thanks ,, if the dime uses love too, it's okay, bro [Username] [URL]"
anger,"[Username] It's not that I have offered to you since 2016/2016, when you are still working as a Honda car sales force and moved to Suzuki and offered to Kog, but instead you block my Whatsapp."
anger,"Gurl, CMA because he publishing the sexual harassment chat he thinks you are Alay, Caper Baper, you will bring him the past, are u fvcking kidding me? No wonder Indonesia is a lot of people who experience sexual harassment prefer to be silent, so how do you still have a lot of netizens."
anger,"Total money in people almost want 600 million. the one who owed the brain or not ... billed pretended to die, there were those who died first, his son begged to return to return it, he was still in college. Waiting for him to go to college, keep working, arriving I have a new grandchildren to pay off maybe Tong"
anger,"BPIP is not important. Turn on the expansion of character, PPKN and PMP. [Username] [URL]"
fear,"What is it? ""If there is one who goes, the other one must be able to make him not go. If later you don't love anymore, so don't you know you have to be more dear. Already after this is not difficult to play true with Dare anymore. Danger"" :)"
happy,"Are you happy? When are you happy, Yu? yes. I am happy that way. As long as other people are happy, especially because of me, I am happy even doubled :)"
love,For me love is a matter of a comfortable and calm heart where you feel comfort and calm means you are in an environment of love and affection. #cinta #kasih #sayang
sadness,"Souma already finished, Yowamushi was already finished. Now watching anime that has long been downloaded but not yet watched at all. Dek Mega Bored with Korean Drama"
happy,"[Username] Good afternoon, Post Friends. apologize just replied. The shipment has been received, friend. Thank you for entrusting and using our services :) ^FD"
sadness,"[Username] :( Coming home from school ceplokin then Mam Baso 10,000 is enough, it used to be that simple ... Boro2 MAW there is a Pansos2an .. IG era so this great event you make your teenage brain unhealthy"
sadness,There are high school kids after farewell or a kind of school graduation. Photos together with his friends with colleagues using kebaya and then posted on the IG with the caption 'later who will marry first'. I immediately bowed listlessly and while wanting to drink extra joss. choke.
happy,The Tenganan Festival became a leading tourism festival in Karangasem which has the#KarangasemtheSiritofbali tagline because it promises the uniqueness of the tradition of cultural traditions that
sadness,"Then Ai Move to Thamrin Yekan. because bored sm tanabang whose clothes are so bae feelings. Eh MSK Thamrin in the basement, the contents are all batik a lot."
anger,"[Username] I am not the queue, but I am waiting for the signature of this academic wadek masyaallah bget yak. yet if the elements that deal with it already. yes especially this is fasting and late home fast hmmm"
anger,"Humans are greedy mother, the minister has been robbed advocates as well, many know the state secrets when in the palace with the New Order, Bandit Bingit"
love,"the world is more and more challenges that make stress ... but the actual drugs are upset when they are gundaing are the calls of the ladies and gentlemen and say ""pray for me,"" then the answers are as good as the answers are when they are blg: ..."
happy,"Special thanks for you, ... still thinking of me as a sister, never once hurt me, still respect me with what I do ..."
fear,"Honestly, I'm really afraid I want to run this again, getting closer, all the time I am afraid of wanting to cry, I don't know why this is very secreted, I ask, I can do it, I can do it, I can be able I"
love,"Love will always open the door to apologize when you do soverees, love will be a lantern when the world becomes dark, keep love until in the end your eyes will fall asleep."
fear,"Already almost maghrib the driver's father told me if the feeling was not really good after I was a charter, dream of an accident, so. And really afraid that the point is that I am not picked up, I am also ashamed of the time to order travel, it's not clever"
sadness,"Still excited, sis, Hani, I hope your father will get the karma as soon as possible. Still diligently praying, the Koran, and also pray, while the month of Ramadan, people like KKA PSTI will be as soon as possible in Kabulin with God, aamiin yaallah [username]"
fear,"Why is it Parnoan. I'm big. Still just haalu, afraid of Sitin. Imagine shadow. I dare to take a shower in a state of obstacles while imagining the scary. there is a sound I am the original lemes until it shuddered really pdhl not strange"
sadness,inayah_k yaiya 'no longer really sad
fear,Temporary cracked speech only less than seven seconds of the red light can not wait for me to cut. New fortune throughout Jogja and Jakarta but the mistakes are always Relovan if the sound of Tik Tok Somay is disagreeing with Pertamina trucks.
anger,"If there is no evidence, it means slander. please [username] follow up on the statement. Don't be considered not brave, sir. [URL]"
love,"Hopefully Allah bless our intentions, unfortunately, it will be made easy to be launched after your good intentions, unfortunately, it's time to arrive so be patient, Amin, Robb Alamin [URL]"
anger,"Sad, angry, annoyed, my gedeg jeng. JKT has only been managed for 5 years by good people, only in 5 months damaged by crazy people."
anger,"Then what about the country? They will lose a lot of income from cigarette excise. The country's debt will be more and more. Ah, that's just your justification. Take a look at this! How? What do you think is still the same? [URL]"
happy,"Sharing with friends is really for. When you feel that your problems are really heavy, it turns out that our own friends have more difficult problems than us. In fact, our problem is nothing compared to his problem."
fear,"This man is scary too, besides his expression spooky words that come out are also very striking. ah okay, Etto IIE Juvia just make sure if I'm not mistaken"
happy,"When the spirit of fasting begins to go down at the end of the month, then Allah gives us enthusiasm with the existence of the night of the lailatu qadar so that we are more enthusiastic about the soswit of God, it is good for Allah, then what is the blessings of your Lord you deny?"
anger,Actually it has begun to be disappointed with Pakdhe [Username] since there was a criminalization of the KPK in the beginning of his government. Plus the case of Baswedan novels that are not complete.
happy,"Why if you see other people doing it scary, but if you do your own brave. If you already see the patient like so you can do anything for them. #eaaaaaa"
anger,"Fadli Zon was sure, ""Basically there are no terrorist seeds in Indonesia"". there is a group of power that is always selling *** ga"
love,"Heavenly Father is not silent and wait until we can pray properly. We can come to Him with our every need, because we believe that He understands and accepts us with love."
happy,"[Username] [Username] Receive you, Pak Kwik ,, that's also my person's thoughts, then I have already said it in the forum. And that's how it is wrong with the one who was by Mrs. Sarumpait."
sadness,"Valuable lessons from the Palestinian and Israeli Civil War. Fellow brothers must love and love each other not to kill each other on a sustainable provocateur who wins, not both parties who won the victory. on behalf of their Lord war."
love,As broad as that I love you ... for those of you who are somewhere now .. healthy and happy always in God ..
anger,"Dear friend man. Can we gather without a cellphone? Why are you gather together but cool yourself, if so it's better at home Bae Nahan Boker"
happy,again buying mrtabak gluing is ready but heavy legs stepping grai listening to the song hayah mas mas lf is also rich: p
sadness,"there is news of the priest who killed his adopted child if I'm not mistaken, even then the victim was pregnant, before being killed was also raped first, sad"
anger,"[Username] [Username] Please don't carry the name of young people bro, if you still debate with sir [username] do not use data let alone sneak. It feels like the millennial generation is lacking in literature."
fear,"Come to think of it, it's true, there's a Google Maps. hnnggg but not that I mean. This is to the village. I'm afraid of being lost, I will disappear"
sadness,"Mother's expectations: Don't be tired of being sick, right? Already rest there reality Mother: Sokorr, wrong you kakean dolan, Domongi Kon Nek Omah Ae Angel Eram #recehkantwitter"
fear,"This is mba. Now org, I like to dismantle old twitt: ""(I sometimes be afraid of speakup cmn because I thought"" was there a twitt I used to be 2009/2010/even if there was someone who asked people? """
happy,[Username] Be a person who is sure because beliefs must shock the mindset that is doubtful with many questions in his mindset and soul. Read !!!! with the name of God who created you [URL]
happy,"No wonder Emiss looking for everywhere it turns out here. Welcome, beautiful! How are the days after choosing a major? I hope the night is fun!"
happy,"When it has been living in Jakarta for a long time where the people there understanding the ""queue"" is very high, even without the words ""please queue"" they already understand that the culture of queuing is everywhere"
love,"If you love you, dear, dear, if you're spoiled, it's spoiled, it's spoiled, if you're aleman, if you're aleman, it's aleman pisan, if you sulk, you sulk, if you are sulking, if you're koplak, don't ask me, he doesn't go to me more than me"
anger,"[Username] I submit a paylatner, but was rejected for detailed reasons. can you help more exact reason? I think the photo of the KTP and the info that I gave is quite clear. What criteria do Traveloka want? [URL]"
sadness,"Helloo, when a vacation is a vacation ... TEYUSS WORK, Eid on Teyus School holidays already want to finish Elisoulea. . . . . #kapanlisturlagi"
anger,Understandably sir ................................................ ........... Jakarta is a radical horde nest! But ............................. left his staff running to Mecca!
sadness,"Already rushed home so I could watch ""The Clash of Titan"" eehh .... Serena decided to retired because of the sleeve muscle injury. Yes, what else ... the health is the main one right? After this is clear, I'm rooting for Maria Sharapova. #ROLANDGARROS18 [URL]"
happy,Amin Amin Mba Dew :) It has been a long time since I felt the sensation of birth so this is not what the progress has been
love,"If I can kiss your lips, you kissed the lips I again believed he would unite and then love blossomed"
anger,[Username] [Username] This is a rule of law. HKM must be the commander. If there is someone who is not spending with what the National Police will make legal efforts from only.
sadness,"I also say my fellow women, breaking the chain will be difficult to owislah ~~ Ibarate sego uwis dadi porridge ~ flying money money"
happy,"Acha funny you are held, you don't want to be carried. Forced in the carrying 2x crying shut up and shut up. It was the turn to take a selfie many times the tip of the edge kissing the cheek, shocked this ante chas you just play sosor [url]"
anger,"Already dizzy. in the chatting brother, which one has forgotten because there are so many who became my driver. then chat with a child who is a class who chat really ""Lum Bubu Si?"" want to vomit !!!"
happy,"A good effort will not betray the results. If you've tried the best, but the results are a little disappointing ... it feels, the heart is more relieved and easier for sincerity. Yes, at least, have tried to be the best."
happy,"For experience, yesterday's day and soul day was not in tune, Rungsing. At first, confide with my friend and finally I contaminated myself. the result: it turns out that God is very kind, giving trust to me to overcome the problem of life that is so complex ..."
anger,"But it's also dangerous, Cal, if so amit2 because the innocence of the mother sieun was told to cut hayam instead of cutting fried beef bala ge teu."
happy,"Open Facebook, Homepage is full of politics ... open ig, just look at people like that .. Open Twitter, I can laugh read the tweets of people ... hahahahaa"
happy,"Nasip W and Adek W are almost the same: we both do not intend to register Poltekkes, almost want to pull out when we want to test, ngasal the contents of the answer, gada hope you want to enter there. In the end: received :) Cmn I majoring in Environmental Health, he is midwifery."
fear,"Look at my friends, just on Kewong. It's also horrified if you think about when when you hear it. the problem is that I have not thought of still scared"
sadness,"Stupidity in the month of Ramadan: last Friday the changing of the cinema for this film, apparently still kamingsun. What a Smart Day. [URL]"
fear,"Not in all places we may perform prayers, one of which is in buildings that are erected for disbelief (one of them is a church). I took refuge in Allaah SWT. From the temptation of the cursed devil."
sadness,"At that time the situation of Indonesia was precarious, in the uncertainty in the amendment not based on high awareness of the figures/elites amendment ... after 20 years the amendment, the significant impact, even though the government was hard to get the government [URL]"
love,"Love understands what is not expressed, feel without being explained, because love is not about a beautiful face but love is about an understanding"
anger,Congratulations to go home! Have a happy jam! PFT
love,"I'm happy with Pisces, and loves sincerely. love what it is. And only with Pisces I don't want to escape, whatever happens. Even in the past if I was called 'stupid' I was willing. ha ha ha. Indeed love makes blind."
happy,"Pak [Username] has been confirmed to be re -elected in the 2019 Presidential Election, its competitors are currently only the democratic process so that they can run well."
sadness,"Once realized that we told them like ex -girlfriends, we laughed grumbling together, because they were only limited to ex -prospective girlfriends."
fear,"You have never felt it, how do you feel like I was able to receive a 7MB quota notification, while you were cool and had to go out looking for a quota again so you could continue to chat."
love,Aa Gervan dear! Don't forget to smile! Let you get more handsome and continue to make me fall in love ehehe
anger,"CMIIW, it feels like a ""mathematical"" connotation that is attached correctly-wrong/not want to compromise is not quite right. mathematicians should be tolerant, non-assuming, and doubt a lot (or all) things to valid evidence-lay"
fear,"[IDM] Army, I just received it in the Department of Food Science and Technology. Is there anyone studying in that major? Help me calm myself because I'm afraid of the period of lectures."
sadness,"There are people who change, so it is more positive or negative, we never know the biggest reason why he changes, if it's wrong, tell me not to be blasphemed"
anger,"[Username] [Username] It should be just let it be bombed, when you sleep, just tightly exploded it, so I don't feel bro, you know in the realm and amp"
happy,"I present this song BWT Pak [Username] [Username] also the Mayor of Solo, Mr. FX Hadi Rudyatmo for making the city of Solo better known thanks to solo songs made [Username] [Username] [URL] #Solo"
happy,"Dibales with a very friendly ""Bonjour Star, it's really okay, tomorrow in building 7. The next day, while degdegan already like wanting the thesis guidance even though it was still in semester II to meet and I immediately showed my PPT."
fear,"[ASKMF] CLEN whose skin is normal skincare or not? :( I take care of the skin to be clean but afraid of why if you use it, it's still small too :("
anger,"[Username] Since a long time ago it was never interested in this kind of event. The event just grinned not to educate, waste time, no benefit. how come it's not ashamed, making a gituan kek [url] event"
happy,Working with heart and always relying on God himself is different and durable. Congratulations to transform into the real comdev. as a friend I always give support dena \
fear,"[Username] Me :( I'm afraid of the same time as the streets are crowded, the guts are fast. But if it's really really good, I can force it, it can only be still rigid: ""("
anger,Why [Username] doesn't get wo sir? It is clear that the violation is that all people know :) Just disperse Indonesian football if the mafia hasn't been destroyed :) [Username] [Username] [Username] [Username]
anger,"Yes, because it's not strong, and feels ""disgusted"", I have chosen to close the account. angry ? very. Finally, I can only grumble to friends close. offended ? It must be clear. but the risk of using ask fm anon can mbacot sakarepe :))"
happy,"Congrats for me, even though I am not active but I dedicate this twitter because of the bangtan, many who changed from the time, wow !!!!! #MyTWITTWITTEANNIVERSARY [URL]"
sadness,The traffic jam is great #parkkir
anger,Damn ish really has a friend like you hahaha xp
sadness,"Why does life say there is cruel? Maybe he considers life as a battle as well as a competition arena. If he thinks like a farmer, then life is like farming, he will feel among the hopes & fear"
anger,"Hayolo now who is begging asking for a sponsor. Yesterday, where was it when I was kind, I wanted to help you. Already tight the event is confused about looking for sponsors. the company itself what you want to ask for help."
fear,"Bodoamat deh my ears in the morning Budeg too, the horror incident this afternoon was still unforgettable. I can't hear the sound. Afraid. So sleep while listening to the song"
anger,"Even though it's just silent. Still talking. Especially not silent. hahah good, it's not quiet. just talking, just fall the same, talk"
love,"[Username] How do you explain it. Yes, the first person can make us feel nervous, want to get to know more, then want to be close to that way. Usually when KLS 6 or junior high school (if I), it's relatively wkwkw"
fear,"My father wants to go to Bali and I tell me about this. then dad said ""if daddy died prayers, blabla"" I swear I was afraid of how the name died."
anger,this must be imprisoned [username] must be reported ... this is the person who divides
happy,"Definitely Caca, Sis Ika! The aura is the most appropriate. The quality of acting is unquestionable. Plus, I don't know what this is, but it will just be annoying if you're a fierce Alex who is fierce but loved but pretty but busy but still able to deal with it"
anger,"Good! It's called self -aware. How could the obscene case suspect be the leader of the people?! Btw, what is the case [username]? Then the story of you nyang 'ntu gimane? [URL]"
happy,"haha seriously, first see that the writing of the tiaw noodle shopman, immediately loud, like an affair, loved but not recognized eeaaaa haha ​​but however it is, their competition is healthy hehe"
happy,"Do you still remember the ""image"" at that time? #1996 The LDR place is a student or just an anchor in the old date asks for a transfer with parents. ""Wartel"" is right on the edge of Jatos today. Not just a gathering place even though it was not wifi or maybe on it there was a student boarding."
anger,"then if you make a status insinuating people? Not really, you feel wrong to feel your sarcastic. Usually I say DL to the person. then make a status. Let me understand the person. I don't like to insinuate people who don't need it. For example, like this: [URL]"
fear,"So last night, I recap, eh the point that I was trying to work turned out to be zero samsek .. presentation at 16.00, I just grasak grusuk at 13.23. Jiaaaaaaann"
sadness,"Let them just blaspheme and hurt you. Because even though they use the verse to justify their actions, you just use the verses of God to focus on improving yourself going forward"
fear,"Don't tell me anymore, gaes [Username] [Username] [Username], this person already has a blog too ... ... even though writing it isn't 2 o'clock in the morning."
love,"I really love him, he is also very fond of me. I'm the same as he's very close, and always playing together, learning together, and already can be a friend of the girlfriend, don't be sad. Many ways to always be together without having to have [URL]"
love,"I just felt what was in love, I couldn't stop it I couldn't stop me who always wanted to be close to you"
happy,HBD [Username] All the Best
sadness,"At that time at that time I had the type of girl that I had to be a girlfriend. But, again ran aground in the middle of the road. After that, start thinking if you love, just love without reason & conditions"
fear,"I once asked, how come the afternoon has come home? ""Lazy mas, afraid of kemaleman. Sometimes like a bear passing by with other wild animals."" Well. dead. Every afternoon I immediately pulled back to Jambi. it has not been disturbed by a mystical figure if you have a kaleman on the road"
fear,When it was 23.50 we were tired and wanted to go home because there had been fear in our hearts.
fear,"want to resign but how come you're afraid that it will not be more better, feel comfortable but how come ... I don't understand what's wrong in me or who the heck"
happy,"MR Roger Toll (Netherlands) material is related to the world of breathing in Indonesia. Wow ... really cool, our country turns out to have 700 languages ​​... ckckckck. #seminarpanji #sastra [username] [URL]"
fear,"I decided to go alone because I was afraid of shaking my heart, and I was afraid that my friends would be sad of course. So I chose to be alone. I will miss Edinburgh Castle, Old Town, Princess Castle, Calton Hill, and others."
anger,"KlikBCA is often difficult to referred to including now. If the internet is answered, I have a problem, I will say it's bullshit because I don't have a problem to open another website."
love,"May God always accompany your every step, and make our relationship stronger in facing all the tests of this life. I love you"
fear,"[BB] I'm sorry, I have been in a chat in my chat and my girlfriend, I just said that I just said that he was so he replied until now he didn't go to me, I didn't, do you think I broke up yet? Thanks"
anger,"Finally in the police, no one helped. It's a pity, yes, the pilgrims are also bloon, just want to be cheated using the Qur'an. Buying and selling verse for lust for power."
anger,DEAR [Username] The Recipient of the Travel and Tourism Awards and 4 Star LCC Daddeling Skytrax! I have repeatedly called call center and email complaints to customer care with complaints number 239835 and RSV229808 Why is it not followed up ??
fear,"Opening your own business, especially many examples of friends who fall. Mr B is also horrified to hear the story of his friends who often fight and bicker with his wife regarding family finances let alone this current condition. That makes it even more horrified to resign. That's the persuasion of devil."
anger,"What is the basis for his stuck? Read only one verse? I'm just ordinary, what are you doing angry? Atheists are actually very ridiculous to me, when they worship Charles Darwin with all the theories of superstition and silly ..."
anger,"Then, even if I'm rarely the same as the X lately, maybe we are entering a complicated dynamics of friendship, yey whose name is humans there must be the slekts. It is not possible to get along all the time, not cool and continue to get along. Then I have to explain, all of you are asking, right?"
fear,"'Liv, don't forget to remember me if I complain first.' 'Liv, don't forget to remember me if my positive vibe in the real world has started to rarely' especially huh"
fear,"already said that the more here the more worried about the votions, the trainees are getting better so I want to be confused who, except for the beginning of the fans of the trainee. Can't be guessed who will debut."
